movie_title,director_name,duration,actors,plot_keywords,language,country,title_year,imdb_score,Genre1,Genre2,Genre3,Genre4,Genre5,Genre6,Genre7,Genre8,content_rating
The Lost World: Jurassic Park ,Steven Spielberg,129,"Ariana Richards, Richard Schiff, Vanessa Lee Chester",capture|dinosaur|island|jurassic|jurassic park,English,USA,1997,6.5,Action,Adventure,Sci-Fi,,,,,,PG-13
Dreamgirls ,Bill Condon,130,"Loretta Devine, Jennifer Hudson, Anika Noni Rose",1960s|fire|pop chart|singer|trio,English,USA,2006,6.5,Drama,Music,Musical,,,,,,PG-13
Spanglish ,James L. Brooks,131,"Adam Sandler, Paz Vega, Sarah Steele",chef|college|housekeeper|letter|mexico,English,USA,2004,6.5,Comedy,Drama,Romance,,,,,,PG-13
The Village ,M. Night Shyamalan,108,"Bryce Dallas Howard, Judy Greer, William Hurt",creature|pact|plot twist|village|woods,English,USA,2004,6.5,Drama,Mystery,Romance,Thriller,,,,,PG-13
Olympus Has Fallen ,Antoine Fuqua,119,"Gerard Butler, Morgan Freeman, Radha Mitchell",political thriller|politics|president|speaker of the house|u.s. president,English,USA,2013,6.5,Action,Thriller,,,,,,,R
Killer Elite ,Gary McKendry,116,"Jason Statham, Robert De Niro, Ben Mendelsohn",australia|death|mentor|revenge|secret society,English,UK,2011,6.5,Action,Crime,Thriller,,,,,,R
Need for Speed ,Scott Waugh,132,"Rami Malek, Dominic Cooper, Ramon Rodriguez",cross country|custom car|illegal street racing|police officer crushed|street racing,English,USA,2014,6.5,Action,Crime,Drama,Thriller,,,,,PG-13
You've Got Mail ,Nora Ephron,119,"Tom Hanks, Jean Stapleton, Dave Chappelle",bookstore|competing businesses|instant messaging|new york city|shop owner,English,USA,1998,6.5,Comedy,Drama,Romance,,,,,,PG
Sin City: A Dame to Kill For ,Frank Miller,102,"Joseph Gordon-Levitt, Bruce Willis, Eva Green",box office flop|female frontal nudity|female rear nudity|jackpot|rescue,English,USA,2014,6.5,Action,Crime,Thriller,,,,,,R
The Horse Whisperer ,Robert Redford,170,"Scarlett Johansson, Kristin Scott Thomas, Jessalyn Gilsig",grace|groom|horse|montana|western u.s.,English,USA,1998,6.5,Drama,Romance,Western,,,,,,PG-13
Ladder 49 ,Jay Russell,115,"Billy Burke, Jay Hernandez, Jacinda Barrett",death of husband|fire|firefighter|funeral|main character dies,English,USA,2004,6.5,Action,Drama,Thriller,,,,,,PG-13
A Civil Action ,Steven Zaillian,115,"Robert Duvall, Kathleen Quinlan, Sydney Pollack",1980s|law firm|lawsuit|lawyer|toxic waste,English,USA,1998,6.5,Drama,,,,,,,,PG-13
Beyond Borders ,Martin Campbell,127,"Angelina Jolie Pitt, Teri Polo, Noah Emmerich",africa|american|border|doctor|well,English,USA,2003,6.5,Adventure,Drama,Romance,War,,,,,R
Instinct ,Jon Turteltaub,126,"Anthony Hopkins, Maura Tierney, John Ashton",africa|anthropologist|murder|poacher|psychiatrist,English,USA,1999,6.5,Drama,Thriller,,,,,,,R
From Paris with Love ,Pierre Morel,92,"Kasia Smutniak, Amber Rose Revah, Rebecca Dayan",ambassador|cia|dinner|spy|terrorist,English,France,2010,6.5,Action,Thriller,,,,,,,R
"Me, Myself & Irene ",Bobby Farrelly,116,"Robert Forster, Tony Cox, Rob Moran",dissociative identity disorder|limousine|multiple personality|police|rhode island,English,USA,2000,6.5,Comedy,,,,,,,,R
The Replacements ,Howard Deutch,118,"Keanu Reeves, Jon Favreau, Faizon Love",coach|football player|misfits|strike|sumo wrestler,English,USA,2000,6.5,Comedy,Sport,,,,,,,PG-13
Out of Time ,Carl Franklin,114,"Denzel Washington, Sanaa Lathan, John Billingsley",cancer|florida|insurance|life insurance policy|small town,English,USA,2003,6.5,Crime,Drama,Romance,Thriller,,,,,R
For Love of the Game ,Sam Raimi,137,"J.K. Simmons, Kelly Preston, Carmine Giovinazzo",baseball|baseball movie|detroit tigers|perfect game|pitcher,English,USA,1999,6.5,Drama,Romance,Sport,,,,,,PG-13
Hereafter ,Clint Eastwood,129,"Matt Damon, Jay Mohr, Cécile De France",death|france|near death experience|tsunami|twin brother,English,USA,2010,6.5,Drama,Fantasy,,,,,,,PG-13
Basic ,John McTiernan,98,"Connie Nielsen, Harry Connick Jr., Tim Daly",2000s|army|military crime|necklace yanked off|panama,English,Germany,2003,6.5,Action,Crime,Drama,Mystery,Thriller,,,,R
The International ,Tom Tykwer,118,"Naomi Watts, Brían F. O'Byrne, Armin Mueller-Stahl",bank|chase|district attorney|interpol|murder,English,USA,2009,6.5,Action,Crime,Drama,Mystery,Thriller,,,,R
The Cotton Club ,Francis Ford Coppola,123,"Nicolas Cage, Bob Hoskins, Fred Gwynne",brothers hugging|jazz|jealousy|nudity|parole violation,English,USA,1984,6.5,Crime,Drama,Music,,,,,,R
The Pelican Brief ,Alan J. Pakula,141,"Denzel Washington, Julia Roberts, Tony Goldwyn",college professor|fbi|president|professor|supreme court,English,USA,1993,6.5,Crime,Drama,Mystery,Thriller,,,,,PG-13
Changing Lanes ,Roger Michell,91,"Sydney Pollack, Matt Malloy, Bruce Altman",car accident|feud|lawyer|revenge|road rage,English,USA,2002,6.5,Drama,Thriller,,,,,,,R
Blended ,Frank Coraci,117,"Bella Thorne, Adam Sandler, Joel McHale",blind date|children|date|daughter|son,English,USA,2014,6.5,Comedy,Romance,,,,,,,PG-13
Savages ,Oliver Stone,141,"Demián Bichir, Shea Whigham, Gary Stretch",arms tied overhead|damsel in distress|dea|marijuana|southern california,English,USA,2012,6.5,Crime,Drama,Thriller,,,,,,R
Cellular ,David R. Ellis,94,"Richard Burgi, Valerie Cruz, Will Beinbrink",cell phone|distress signal|family in danger|police|stealing a car,English,USA,2004,6.5,Action,Crime,Thriller,,,,,,PG-13
Big Trouble ,Barry Sonnenfeld,74,"Zooey Deschanel, Janeane Garofalo, Omar Epps",airport|fbi agent|person in a car trunk|suitcase|suitcase bomb,English,USA,2002,6.5,Comedy,Crime,Thriller,,,,,,PG-13
Charlie St. Cloud ,Burr Steers,99,"Augustus Prew, Charlie Tahan, Valerie Tian",brother brother relationship|death of brother|ghost|seeing dead people|talking with the dead,English,USA,2010,6.5,Drama,Fantasy,Romance,,,,,,PG-13
Here Comes the Boom ,Frank Coraci,105,"Salma Hayek, Reggie Lee, Charice",claim in title|high school|mixed martial arts|ultimate fighting championship|underdog,English,USA,2012,6.5,Action,Comedy,Sport,,,,,,PG
The Mirror Has Two Faces ,Barbra Streisand,122,"Jeff Bridges, Austin Pendleton, Mimi Rogers",columbia university|lecture|marriage|professor|sex,English,USA,1996,6.5,Comedy,Drama,Romance,,,,,,PG-13
The Mothman Prophecies ,Mark Pellington,119,"Debra Messing, Will Patton, David Eigenberg",car accident|death of wife|mothman|point pleasant west virginia|urban legend,English,USA,2002,6.5,Drama,Horror,Mystery,Thriller,,,,,PG-13
The Skeleton Key ,Iain Softley,104,"Gena Rowlands, Deneen Tyler, Joy Bryant",attic|bound and gagged|hoodoo|secret|southern gothic,English,USA,2005,6.5,Horror,Mystery,Thriller,,,,,,PG-13
Music and Lyrics ,Marc Lawrence,95,"Brad Garrett, Scott Porter, Haley Bennett",love|lyricist|singer|singing|song,English,USA,2007,6.5,Comedy,Music,Romance,,,,,,PG-13
8MM ,Joel Schumacher,123,"Nicolas Cage, Chris Bauer, Anthony Heald",investigation|obsession|private eye|private investigator|snuff film,English,Germany,1999,6.5,Mystery,Thriller,,,,,,,R
Morning Glory ,Roger Michell,107,"Noah Bean, Patti D'Arbanville, Vanessa Aspillaga",job offer|roller coaster|slow motion action scene|slow motion sequence|television,English,USA,2010,6.5,Comedy,Drama,Romance,,,,,,PG-13
Big Miracle ,Ken Kwapis,107,"Ted Danson, Tim Blake Nelson, Andrew Daly",arctic circle|reporter|small town|volunteer|whale,English,USA,2012,6.5,Biography,Drama,Romance,,,,,,PG
Soul Men ,Malcolm D. Lee,100,"Bernie Mac, Sean Hayes, Mike Epps",band|masturbation|reunion|singer|tribute,English,USA,2008,6.5,Comedy,Drama,Music,,,,,,R
The Ugly Truth ,Robert Luketic,96,"Gerard Butler, John Michael Higgins, Eric Winter",call in|chick flick|date|hot air balloon|show producer,English,USA,2009,6.5,Comedy,Romance,,,,,,,R
The Grandmaster ,Kar-Wai Wong,122,"Tony Chiu Wai Leung, Hye-kyo Song, Elvis Tsui",challenge|china|hong kong|martial arts|martial arts master,Mandarin,Hong Kong,2013,6.5,Action,Biography,Drama,,,,,,PG-13
City of Ember ,Gil Kenan,90,"Bill Murray, Toby Jones, Harry Treadaway",box|food|mayor|pipeworks|scientist,English,USA,2008,6.5,Adventure,Family,Fantasy,Sci-Fi,,,,,PG
Premium Rush ,David Koepp,91,"Joseph Gordon-Levitt, Dania Ramirez, Aasif Mandvi",chase|courier|delivery|envelope|police,English,USA,2012,6.5,Action,Crime,Thriller,,,,,,PG-13
The Four Feathers ,Shekhar Kapur,125,"Djimon Hounsou, Lucy Gordon, Alex Jennings",male nudity|naked dead man|nudity|sex|whipping,English,UK,2002,6.5,Adventure,Drama,Romance,War,,,,,PG-13
Step Up Revolution ,Scott Speer,99,"Ryan Guzman, Stephen Boss, Misha Gabriel Hamilton",3 dimensional|dance|dancer|dancing|flash mob,English,USA,2012,6.5,Drama,Music,Romance,,,,,,PG-13
The Punisher ,Jonathan Hensleigh,140,"Laura Harring, Marco St. John, Eddie Jemison",death|family reunion|fbi|fbi agent|vigilante,English,USA,2004,6.5,Action,Crime,Drama,Thriller,,,,,R
Safe ,Boaz Yakin,94,"Jason Statham, Reggie Lee, Robert John Burke",bodyguard|gang war|russian|russian mafia|triad,English,USA,2012,6.5,Action,Crime,Thriller,,,,,,R
Extraordinary Measures ,Tom Vaughan,106,"Harrison Ford, Brendan Fraser, Alan Ruck",cure|disease|imagination|race against time|venture capital,English,USA,2010,6.5,Drama,,,,,,,,PG
Letters to Juliet ,Gary Winick,105,"Vanessa Redgrave, Marcia DeBonis, Luisa Ranieri",chick flick|female protagonist|italian stereotype|man in a swimsuit|verona italy,English,USA,2010,6.5,Comedy,Drama,Romance,,,,,,PG
Dead Man Down ,Niels Arden Oplev,118,"Dominic Cooper, Isabelle Huppert, James Biberi",crime lord|dead body|dead body in a freezer|new york city|truck explosion,English,USA,2013,6.5,Action,Crime,Drama,Thriller,,,,,R
Pitch Perfect 2 ,Elizabeth Banks,115,"Anna Kendrick, Birgitte Hjort Sørensen, Hana Mae Lee",2010s|a cappella|box office hit|second part|sequel,English,USA,2015,6.5,Comedy,Music,,,,,,,PG-13
Harlock: Space Pirate ,Shinji Aramaki,115,"Shun Oguri, Yû Aoi, Haruma Miura",liberty|space adventure|space opera|time travel|undercover agent,Japanese,Japan,2013,6.5,Adventure,Animation,Sci-Fi,,,,,,Not Rated
How to Lose Friends & Alienate People ,Robert B. Weide,110,"James Corden, Katherine Parkinson, Fenella Woolgar",celebrity|party|pig|starlet|writer,English,UK,2008,6.5,Comedy,Drama,Romance,,,,,,R
A Walk Among the Tombstones ,Scott Frank,114,"Liam Neeson, Boyd Holbrook, David Harbour",drug dealer|ex cop|murder of wife|revenge|violence,English,USA,2014,6.5,Crime,Drama,Mystery,Thriller,,,,,R
Red Eye ,Wes Craven,85,"Robert Pine, Carl Gilliard, Suzie Plakson",airport|flight|hotel|hotel manager|plane,English,USA,2005,6.5,Mystery,Thriller,,,,,,,PG-13
Pain & Gain ,Michael Bay,129,"Dwayne Johnson, Larry Hankin, Michael Rispoli",american dream|bodybuilder|money|punch into the camera|reference to julia roberts,English,USA,2013,6.5,Comedy,Crime,Drama,,,,,,R
In Good Company ,Paul Weitz,109,"Scarlett Johansson, Ty Burrell, Dennis Quaid",company|corporate takeover|executive|magazine|new boss,English,USA,2004,6.5,Comedy,Drama,Romance,,,,,,PG-13
Self/less ,Tarsem Singh,117,"Ryan Reynolds, Derek Luke, Sandra Ellis Lafferty",cancer|elderly man|funeral|medical|transhumanism,English,USA,2015,6.5,Action,Mystery,Sci-Fi,Thriller,,,,,PG-13
The Lucky One ,Scott Hicks,101,"Blythe Danner, Riley Thomas Stewart, Jay R. Ferguson",arrogance|child in peril|disarming someone|kennel|post traumatic stress disorder,English,USA,2012,6.5,Drama,Romance,,,,,,,PG-13
Contraband ,Baltasar Kormákur,109,"J.K. Simmons, David O'Hara, Lukas Haas",cocaine|contraband|drug lord|prison|smuggling,English,USA,2012,6.5,Action,Crime,Drama,Thriller,,,,,R
The Giver ,Phillip Noyce,97,"Jeff Bridges, Meryl Streep, Alexander Skarsgård",black and white segues into color|color|community|dystopia|infanticide,English,South Africa,2014,6.5,Drama,Romance,Sci-Fi,,,,,,PG-13
Blood Ties ,Guillaume Canet,144,"Mila Kunis, Lili Taylor, Billy Crudup",1970s|flashback|love|money|murder,English,France,2013,6.5,Crime,Drama,Thriller,,,,,,R
Stop-Loss ,Kimberly Peirce,112,"Joseph Gordon-Levitt, Channing Tatum, Abbie Cornish",friendship|honor|iraq war|soldier|texas,English,USA,2008,6.5,Drama,War,,,,,,,R
Where the Truth Lies ,Atom Egoyan,107,"Colin Firth, Alison Lohman, Rachel Blanchard",breasts|death|female rear nudity|lesbian cunnilingus|rear entry sex,English,Canada,2005,6.5,Crime,Drama,Mystery,Thriller,,,,,R
Kung Fu Killer ,Teddy Chan,100,"Siu-Wong Fan, Charlie Yeung, Wai-Keung Lau",fight|kung fu|martial arts|police|wire fu,Cantonese,China,2014,6.5,Action,Drama,,,,,,,
Footloose ,Herbert Ross,107,"Dianne Wiest, Chris Penn, Lori Singer",church|cowboy boots|dancing|high school dance|teenager,English,USA,1984,6.5,Drama,Music,Romance,,,,,,PG
Faster ,George Tillman Jr.,98,"Dwayne Johnson, Tom Berenger, Mike Epps",gun|prison|reference to god|reference to jesus christ|vengeance,English,USA,2010,6.5,Action,Crime,Drama,Thriller,,,,,R
The Informant! ,Steven Soderbergh,108,"Matt Damon, Joel McHale, Thomas F. Wilson",compulsive liar|fbi|informant|investigation|spy,English,USA,2009,6.5,Comedy,Crime,Drama,Thriller,,,,,R
Homefront ,Gary Fleder,100,"Jason Statham, James Franco, Frank Grillo",biker|biker gang|dea|dea agent|fight,English,USA,2013,6.5,Action,Crime,Drama,Thriller,,,,,R
My Fellow Americans ,Peter Segal,101,"Wilford Brimley, Bradley Whitford, Sela Ward",gay pride|highway travel|president|road movie|u.s. president,English,USA,1996,6.5,Adventure,Comedy,,,,,,,PG-13
Wild Things ,John McNaughton,115,"Bill Murray, Robert Wagner, Jeff Perry",erotic thriller|forbidden sex|lesbian sex|sex with a student|taboo sex,English,USA,1998,6.5,Crime,Drama,Mystery,Thriller,,,,,R
Daybreakers ,Michael Spierig,98,"Jay Laga'aia, Damien Garvey, Tiffany Lamb",blood|rationing|vampire|vampire society|year 2019,English,Australia,2009,6.5,Action,Horror,Sci-Fi,Thriller,,,,,R
A Dangerous Method ,David Cronenberg,99,"Michael Fassbender, Viggo Mortensen, Sarah Gadon",carl jung|patient|psychoanalysis|russian|sigmund freud,English,UK,2011,6.5,Biography,Drama,Thriller,,,,,,R
Passchendaele ,Paul Gross,114,"Landon Liboiron, Michael Greyeyes, Caroline Dhavernas",battle|canadian armed forces|canadian soldier|directed by star|veteran,English,Canada,2008,6.5,Drama,History,Romance,War,,,,,R
CJ7 ,Stephen Chow,86,"Jiao Xu, Yuqi Zhang, Chi Chung Lam",father son relationship|miracle|school|ufo|written and directed by cast member,Cantonese,Hong Kong,2008,6.5,Comedy,Family,Sci-Fi,,,,,,PG
The Crazies ,Breck Eisner,101,"Radha Mitchell, Glenn Morshower, John Aylward",deputy|iowa|rural setting|sheriff|survival,English,USA,2010,6.5,Horror,Thriller,,,,,,,R
Sex Drive ,Sean Anders,129,"Katrina Bowden, Michael Cudlitz, Alice Greczyn",amish|friend|friendship|high school|virgin,English,USA,2008,6.5,Adventure,Comedy,Romance,,,,,,R
Youth in Revolt ,Miguel Arteta,90,"Steve Buscemi, Ari Graynor, Fred Willard",alter ego|boarding school|love|masturbation|teen movie,English,USA,2009,6.5,Comedy,Drama,Romance,,,,,,R
Hoodwinked! ,Cory Edwards,80,"Anne Hathaway, Chazz Palminteri, Jim Belushi",animal|axe|red riding hood|wolf|woodsman,English,USA,2005,6.5,Action,Animation,Comedy,Crime,Family,,,,PG
Let's Be Cops ,Luke Greenfield,104,"Rob Riggle, Damon Wayans Jr., James D'Arcy",friendship between men|impersonating a police officer|mobster|party|police officer,English,USA,2014,6.5,Comedy,,,,,,,,R
Evil Dead ,Fede Alvarez,96,"Lou Taylor Pucci, Elizabeth Blackmore, Ellen Sandweiss",book of the dead|demon|h.p. lovecraft|lesbian kiss|promise,English,USA,2013,6.5,Horror,,,,,,,,R
Fur: An Imaginary Portrait of Diane Arbus ,Steven Shainberg,122,"Robert Downey Jr., Ty Burrell, Matt Servitto",character name in title|diane arbus|male full frontal nudity|photographer|pubic hair,English,USA,2006,6.5,Biography,Drama,Romance,,,,,,R
Road Trip ,Todd Phillips,94,"Ethan Suplee, Rachel Blanchard, Paulo Costanzo",blonde|college|friend|highway travel|road trip,English,USA,2000,6.5,Comedy,,,,,,,,R
Madison ,William Bindley,94,"Bruce Dern, Jake Lloyd, William Shockley",boat racing|hydroplane|loyalty|one word title|scolding,English,USA,2001,6.5,Drama,Sport,,,,,,,PG
Slither ,James Gunn,95,"Dustin Milligan, Gregg Henry, Tania Saulnier",alien|b movie|sex|slug|small town,English,Canada,2006,6.5,Comedy,Horror,Sci-Fi,,,,,,R
Snitch ,Ric Roman Waugh,112,"Dwayne Johnson, Harold Perrineau, Nadine Velazquez",cigarette smoking|dea|drugs|inspired by true events|undercover,English,USA,2013,6.5,Action,Drama,Thriller,,,,,,PG-13
Jakob the Liar ,Peter Kassovitz,120,"Robin Williams, Mark Margolis, Michael Jeter",german|ghetto|hope|nazi|radio,English,France,1999,6.5,Drama,War,,,,,,,PG-13
Funny Games ,Michael Haneke,111,"Naomi Watts, Siobhan Fallon Hogan, Brady Corbet",breaking the fourth wall|looking at the camera|remake|serial killer|violence,English,USA,2007,6.5,Crime,Drama,Horror,Thriller,,,,,R
A Perfect Getaway ,David Twohy,108,"Chris Hemsworth, Milla Jovovich, Marley Shelton",cliff|hawaii|island|newlywed|waterfall,English,USA,2009,6.5,Adventure,Mystery,Thriller,,,,,,R
Caravans ,James Fargo,127,"Christopher Lee, Joseph Cotten, Behrouz Vossoughi",afghanistan|caravan|rebel|russian|tribe,English,Iran,1978,6.5,Action,Adventure,History,,,,,,PG
Margaret ,Kenneth Lonergan,186,"Matt Damon, Kieran Culkin, John Gallagher Jr.",accident|bus|loss of virginity|new york city|virginity,English,USA,2011,6.5,Drama,,,,,,,,R
Crazy/Beautiful ,John Stockwell,135,"Kirsten Dunst, Jay Hernandez, Rolando Molina",congressman|high school|latino|pacific palisades|school,English,USA,2001,6.5,Drama,Romance,,,,,,,PG-13
The Claim ,Michael Winterbottom,115,"Milla Jovovich, Sarah Polley, Shirley Henderson",gold|gold mine|miner|railroad|surveyor,English,UK,2000,6.5,Drama,Romance,Western,,,,,,R
Act of Valor ,Mike McCoy,110,"Alex Veadov, Jason Cottle, Rorke Denver",mission|navy seal|terrorist|torture|valor,English,USA,2012,6.5,Action,Adventure,Drama,Thriller,War,,,,R
Step Up ,Anne Fletcher,104,"Channing Tatum, Alyson Stoner, Josh Henderson",dance|dancer|school|showcase|student,English,USA,2006,6.5,Crime,Drama,Music,Romance,,,,,PG-13
Top Five ,Chris Rock,102,"Rosario Dawson, Romany Malco, J.B. Smoove",bare breasts|celebrity|in medias res|reference to planet of the apes|sex talk,English,USA,2014,6.5,Comedy,Romance,,,,,,,R
In the Land of Women ,Jon Kasdan,97,"Kristen Stewart, Elena Anaya, Dustin Milligan",actress|love|michigan|neighbor|writer,English,USA,2007,6.5,Comedy,Drama,Romance,,,,,,PG-13
Recess: School's Out ,Chuck Sheetz,82,"Diedrich Bader, Andrew Lawrence, Dabney Coleman",friend|principal|summer|summer camp|summer vacation,English,USA,2001,6.5,Animation,Comedy,Family,Mystery,Sci-Fi,,,,G
Twilight Zone: The Movie ,Joe Dante,101,"Albert Brooks, Al Leong, Vic Morrow",1940s|1960s|bar|kick the can|remake,English,USA,1983,6.5,Fantasy,Horror,Sci-Fi,,,,,,PG
Road House ,Rowdy Herrington,114,"Ben Gazzara, Kevin Tighe, Kelly Lynch",bikini|cult film|fired from the job|martial arts|violence,English,USA,1989,6.5,Action,Thriller,,,,,,,R
Can't Hardly Wait ,Harry Elfont,100,"Ethan Embry, Lauren Ambrose, Charlie Korsmo",graduation|high school|letter|nerd|party,English,USA,1998,6.5,Comedy,Romance,,,,,,,PG-13
Mo' Better Blues ,Spike Lee,129,"Denzel Washington, Nicholas Turturro, Charlie Murphy",comeback|friend|jazz|stage|trumpet,English,USA,1990,6.5,Drama,Music,Romance,,,,,,R
Drop Dead Gorgeous ,Michael Patrick Jann,97,"Kirsten Dunst, Kirstie Alley, Ellen Barkin",beauty pageant|blonde|cheerleader uniform|small town|upskirt,English,Germany,1999,6.5,Comedy,Romance,Thriller,,,,,,PG-13
"Jeff, Who Lives at Home ",Jay Duplass,83,"Judy Greer, Evan Ross, Rae Dawn Chong",basement|errand|secret admirer|slacker|wrong number,English,USA,2011,6.5,Comedy,Drama,,,,,,,R
Bamboozled ,Spike Lee,135,"Gillian White, Michael Rapaport, Jada Pinkett Smith",actor|minstrel show|protest|success|writer,English,USA,2000,6.5,Comedy,Drama,Music,,,,,,R
The Joneses ,Derrick Borte,96,"Demi Moore, Gary Cole, Robert Pralgo",envy|fake family|gadget|materialism|unhappy marriage,English,USA,2009,6.5,Comedy,Drama,,,,,,,R
Elsa & Fred ,Michael Radford,97,"Chris Noth, Jared Gilman, James Brolin",apartment|death of protagonist|follow that car|la dolce vita|love,English,USA,2014,6.5,Comedy,Drama,Romance,,,,,,PG-13
Gunless ,William Phillips,89,"Tyler Mane, Callum Rennie, Dustin Milligan",blacksmith|bounty hunter|duel|gunslinger|wild west,English,Canada,2010,6.5,Action,Comedy,Drama,Western,,,,,
Child's Play ,Tom Holland,87,"Catherine Hicks, Alex Vincent, Dinah Manoff",birthday|doll|murder|serial killer|voodoo,English,USA,1988,6.5,Fantasy,Horror,,,,,,,R
The Purge: Anarchy ,James DeMonaco,103,"Noel Gugliemi, Zach Gilford, Roberta Valderrama",held at gunpoint|machete|masked man|sequel|violence,English,USA,2014,6.5,Action,Horror,Sci-Fi,Thriller,,,,,R
PCU ,Hart Bochner,79,"Jon Favreau, Matt Ross, Chris Young",college|high school senior|meat|protest|university,English,USA,1994,6.5,Comedy,,,,,,,,PG-13
Veronika Decides to Die ,Emily Young,103,"Sarah Michelle Gellar, Erika Christensen, Jonathan Tucker",boyfriend girlfriend relationship|female protagonist|letter of resignation|mental hospital|sex,English,USA,2009,6.5,Drama,Romance,,,,,,,R
Crocodile Dundee ,Peter Faiman,93,"Paul Hogan, Linda Kozlowski, David Gulpilil",australian outback|crocodile|female reporter|journalist|new york city,English,Australia,1986,6.5,Adventure,Comedy,,,,,,,PG-13
Awake ,Joby Harold,84,"Hayden Christensen, Fisher Stevens, Denis O'Hare",anesthetic|anesthetic awareness|heart|heart surgery|surgery,English,USA,2007,6.5,Crime,Mystery,Thriller,,,,,,R
The DUFF ,Ari Sandel,101,"Bella Thorne, Romany Malco, Skyler Samuels",cartoon on tv|generation y|high school|overalls|strong female character,English,USA,2015,6.5,Comedy,,,,,,,,PG-13
Brown Sugar ,Rick Famuyiwa,109,"Boris Kodjoe, Sanaa Lathan, Wendell Pierce",basketball|hip hop|rap music|record company|writer,English,USA,2002,6.5,Comedy,Drama,Music,Romance,,,,,PG-13
The Good Girl ,Miguel Arteta,93,"Jake Gyllenhaal, Zooey Deschanel, Tim Blake Nelson",dysfunctional marriage|marijuana|small town|store|trying to conceive,English,USA,2002,6.5,Drama,Romance,,,,,,,R
The Inkwell ,Matty Rich,110,"Jada Pinkett Smith, Joe Morton, Larenz Tate",fire|marriage|martha's vineyard|teenager|vacation,English,USA,1994,6.5,Comedy,Drama,Romance,,,,,,R
Down in the Valley ,David Jacobson,108,"Hunter Parrish, Bruce Dern, Rory Culkin",beach|cowboy|cowboy hat|neo western|valley,English,USA,2005,6.5,Drama,Romance,Thriller,,,,,,R
The Blood of Heroes ,David Webb Peoples,90,"Delroy Lindo, Joan Chen, Anna Katarina",battle|blood splatter|combat|game|showdown,English,Australia,1989,6.5,Action,Sci-Fi,Sport,,,,,,R
The Other Side of Heaven ,Mitch Davis,113,"Anne Hathaway, Nathaniel Lees, Miriama Smith",1950s|idaho|love|missionary|mormon,English,USA,2001,6.5,Adventure,Biography,Drama,,,,,,PG
The Mighty Macs ,Tim Chambers,99,"Ellen Burstyn, Marley Shelton, Jennifer Butler",basketball|catholic|coach|college|nun,English,USA,2009,6.5,Drama,Sport,,,,,,,G
Freeheld ,Peter Sollett,103,"Steve Carell, Josh Charles, Luke Grimes",cancer|gay bar|lesbian kiss|partner|public hearing,English,USA,2015,6.5,Biography,Drama,Romance,,,,,,PG-13
"Remember Me, My Love ",Gabriele Muccino,125,"Laura Morante, Silvio Muccino, Giulia Michelini",box office hit|dancer|sex scene|television|underage sex,Italian,Italy,2003,6.5,Comedy,Drama,Romance,,,,,,R
Tracker ,Ian Sharp,102,"Ray Winstone, Jed Brophy, Temuera Morrison",one word title,English,New Zealand,2010,6.5,Action,Adventure,Drama,Western,,,,,R
Dolphins and Whales 3D: Tribes of the Ocean ,Jean-Jacques Mantello,42,"Charlotte Rampling, Daryl Hannah",3d in title|animal in title|digit in title|dolphin|manatee,English,UK,2008,6.5,Adventure,Documentary,Short,,,,,,
Freaky Deaky ,Charles Matthau,90,"Billy Burke, Michael Jai White, Bill Duke",black panties|bomb squad|car bomb|dynamite|girl in panties,English,USA,2012,6.5,Comedy,Crime,Thriller,,,,,,R
Oculus ,Mike Flanagan,104,"James Lafferty, Rory Cochrane, Garrett Ryan",home office|mirror|released from a mental hospital|trauma|video camera,English,USA,2013,6.5,Horror,Mystery,,,,,,,R
The Awakening ,Nick Murphy,107,"Isaac Hempstead Wright, Imelda Staunton, Joseph Mawle",boarding school|boy|british horror|ghost|school,English,UK,2011,6.5,Horror,Thriller,,,,,,,R
Life During Wartime ,Todd Solondz,98,"Rich Pecci, Shirley Henderson, Charlotte Rampling",forgiveness|ghost|new jersey|pedophile|three sisters,English,USA,2009,6.5,Comedy,Drama,,,,,,,R
Mean Machine ,Barry Skolnick,99,"Jason Statham, Jason Flemyng, Danny Dyer",inmate|prison|prison guard|soccer|soccer star,English,UK,2001,6.5,Comedy,Drama,Sport,,,,,,R
Night Watch ,Timur Bekmambetov,104,"Konstantin Khabenskiy, Aleksey Chadov, Zhanna Friske",battle|bridge|mother son relationship|supernatural power|vampire,Russian,Russia,2004,6.5,Fantasy,Thriller,,,,,,,R
You Kill Me ,John Dahl,93,"Philip Baker Hall, Aaron Hughes, Jayne Eastwood",alcoholic|buffalo new york|claim in title|embalming|mortuary,English,USA,2007,6.5,Comedy,Crime,Romance,Thriller,,,,,R
Stake Land ,Jim Mickle,98,"Connor Paolo, Michael Cerveris, Nick Damici",canada|post apocalypse|road movie|vampire|vampire hunter,English,USA,2010,6.5,Drama,Horror,Sci-Fi,,,,,,R
Ira & Abby ,Robert Cary,101,"Frances Conroy, Fred Willard, Kevin Sussman",erectile dysfunction|mugger|mugging|subway robbery|therapy,English,USA,2006,6.5,Comedy,Romance,,,,,,,R
Choke ,Clark Gregg,92,"Anjelica Huston, Matt Gerald, Jonah Bobo",choking|friend|hospital|restaurant|scam,English,USA,2008,6.5,Comedy,Drama,,,,,,,R
Phantasm II ,Don Coscarelli,97,"Angus Scrimm, A. Michael Baldwin, James Le Gros",cemetery|female nudity|mortuary|sphere|tall man,English,USA,1988,6.5,Action,Fantasy,Horror,Sci-Fi,Thriller,,,,R
Boynton Beach Club ,Susan Seidelman,105,"Dyan Cannon, Michael Nouri, Brenda Vaccaro",title spoken by character,English,USA,2005,6.5,Comedy,Romance,,,,,,,R
