movie_title,director_name,duration,actors,plot_keywords,language,country,title_year,imdb_score,Genre1,Genre2,Genre3,Genre4,Genre5,Genre6,Genre7,Genre8,content_rating
Savage Grace ,Tom Kalin,97,"Eddie Redmayne, Elena Anaya, Stephen Dillane",incest|male nudity|older man younger woman relationship|orgasm|son murders mother,English,Spain,2007,5.9,Drama,,,,,,,,Not Rated
After.Life ,Agnieszka Wojtowicz-Vosloo,104,"Liam Neeson, Josh Charles, Chandler Canterbury",breath on mirror|buried alive|engagement ring|looking at one's self in a mirror|serial killer,English,USA,2009,5.9,Drama,Horror,Mystery,Thriller,,,,,R
R.L. Stine's Monsterville: The Cabinet of Souls ,Peter DeLuise,85,"Katherine McNamara, Dove Cameron, Braeden Lemasters",cabinet|carnival|halloween|soul|temptress,English,USA,2015,5.9,Comedy,,,,,,,,PG
The Night Listener ,Patrick Stettner,81,"Robin Williams, Joe Morton, Rory Culkin",boy|radio show|social worker|telephone|wisconsin,English,USA,2006,5.9,Crime,Mystery,Thriller,,,,,,R
Prison ,Renny Harlin,102,"Viggo Mortensen, Lane Smith, Hal Landon Jr.",electric chair|haunting|prison|prisoner|revenge,English,USA,1987,5.9,Crime,Drama,Horror,Thriller,,,,,R
Among Giants ,Sam Miller,93,"Rachel Griffiths, Alan Williams, Rob Jarvis",australian|female armpit hair|friend|sheffield|yorkshire,English,UK,1998,5.9,Comedy,Romance,,,,,,,R
Jason Lives: Friday the 13th Part VI ,Tom McLoughlin,86,"Tony Goldwyn, Ron Palillo, Vincent Guastaferro",actual animal killed|death|jason voorhees|slasher flick|teen horror,English,USA,1986,5.9,Horror,Thriller,,,,,,,R
Next Day Air ,Benny Boom,84,"Omari Hardwick, Donald Faison, Mike Epps",cocaine|package|slow motion scene|topless female nudity|wrong address,English,USA,2009,5.9,Action,Comedy,Crime,,,,,,R
Fort McCoy ,Kate Connor,100,"Johnny Pacar, Eric Stoltz, Brendan Fehr",,English,USA,2011,5.9,Drama,History,War,,,,,,R
Tanner Hall ,Francesca Gregorini,96,"Tom Everett Scott, Amy Sedaris, Chris Kattan",boarding school|coming of age|female friendship|lesbian|new england,English,USA,2009,5.9,Drama,,,,,,,,R
Barry Munday ,Chris D'Arienzo,95,"Judy Greer, Cybill Shepherd, Shea Whigham",doctor|letter|paternity|sex|testicles,English,USA,2010,5.9,Comedy,Drama,Romance,,,,,,R
Friday the 13th: The Final Chapter ,Joseph Zito,97,"Judie Aronson, Tom Everett, Kimberly Beck",friday the thirteenth|hockey mask|jason voorhees|morgue|slasher,English,USA,1984,5.9,Horror,Thriller,,,,,,,R
Sleep Dealer ,Alex Rivera,90,"Leonor Varela, Jacob Vargas, Tenoch Huerta",computer|future|mexican immigrant|network|wilhelm scream,Spanish,USA,2008,5.9,Drama,Romance,Sci-Fi,Thriller,,,,,PG-13
Redemption Road ,Mario Van Peebles,95,"Tom Skerritt, Cinda McCain, Luke Perry",death of loved one|loss of father|loss of loved one|musician|singer,English,USA,2010,5.9,Drama,,,,,,,,PG-13
The Last Sin Eater ,Michael Landon Jr.,117,"Henry Thomas, Louise Fletcher, A.J. Buckley",1850s|christian film|dark secret|funeral|sin eater,English,USA,2007,5.9,Drama,,,,,,,,PG-13
Do You Believe? ,Jon Gunn,120,"Alexa PenaVega, Delroy Lindo, Madison Pettis",belief|faith|pastor|question in title|three word title,English,USA,2015,5.9,Drama,,,,,,,,PG-13
The Last Five Years ,Richard LaGravenese,94,"Anna Kendrick, Jeremy Jordan, Charly Bivona",based on play|number in title,English,USA,2014,5.9,Comedy,Drama,Musical,Romance,,,,,PG-13
Return of the Living Dead III ,Brian Yuzna,97,"Melinda Clarke, Kent McCord, Sarah Douglas",female nudity|living dead|self mutilation|sequel|zombie,English,USA,1993,5.9,Horror,Romance,Sci-Fi,,,,,,R
From a Whisper to a Scream ,Jeff Burr,92,"Terry Kiser, Clu Gulager, Susan Tyrrell",bathtub|cult film|neck breaking|tennessee|wraparound story,English,USA,1987,5.9,Action,Drama,Horror,Thriller,,,,,R
Cry_Wolf ,Jeff Wadlow,90,"Julian Morris, Gary Cole, Lindy Booth",e mail|game|school|serial killer|student,English,USA,2005,5.9,Drama,Horror,Mystery,Thriller,,,,,PG-13
Jesse ,,30,"Eric Lloyd, David DeLuise, Bruno Campos",1990s|brother sister relationship|female protagonist|single mother|sitcom,English,USA,,5.9,Comedy,,,,,,,,
Circumstance ,Maryam Keshavarz,107,"Sarah Kazemy, Reza Sixo Safai, Sina Amedson",closeted lesbian|iranian|islamophobia|propaganda|teenager,Persian,France,2011,5.9,Drama,,,,,,,,R
Kingdom of the Spiders ,John 'Bud' Cardos,97,"Woody Strode, Hoke Howell, Tiffany Bolling",death|farm|hotel|spider|tarantula,English,USA,1977,5.9,Horror,Sci-Fi,,,,,,,PG
Straight Out of Brooklyn ,Matty Rich,91,"Lawrence Gilliard Jr., George T. Odom, Matty Rich",domestic violence|housing project|new york city|poverty|racism,English,USA,1991,5.9,Crime,Drama,,,,,,,R
2012 ,Roland Emmerich,158,"Oliver Platt, Liam James, Tom McCarthy",ark|catastrophe|geologist|president|writer,English,USA,2009,5.8,Action,Adventure,Sci-Fi,,,,,,PG-13
G.I. Joe: The Rise of Cobra ,Stephen Sommers,118,"Joseph Gordon-Levitt, Dennis Quaid, Leo Howard",cobra|gi joe|snake|train|warhead,English,USA,2009,5.8,Action,Adventure,Sci-Fi,Thriller,,,,,PG-13
Wrath of the Titans ,Jonathan Liebesman,99,"Liam Neeson, Edgar Ramírez, Lily James",ares|hades|titan|underworld|zeus,English,USA,2012,5.8,Action,Adventure,Fantasy,,,,,,PG-13
The Wolfman ,Joe Johnston,119,"Anthony Hopkins, Simon Merrells, Art Malik",asylum|death|full moon|transformation|werewolf,English,USA,2010,5.8,Drama,Fantasy,Horror,Thriller,,,,,R
Pan ,Joe Wright,111,"Hugh Jackman, Cara Delevingne, Nonso Anozie",1940s|child hero|fantasy world|orphan|reference to peter pan,English,USA,2015,5.8,Adventure,Family,Fantasy,,,,,,PG
G.I. Joe: Retaliation ,Jon M. Chu,122,"Channing Tatum, Dwayne Johnson, Elodie Yung",general|gi joe|martial arts|ninja|president,English,USA,2013,5.8,Action,Adventure,Sci-Fi,Thriller,,,,,PG-13
Noah ,Darren Aronofsky,138,"Anthony Hopkins, Emma Watson, Logan Lerman",ark|flood|noah's ark|water|wrath of god,English,USA,2014,5.8,Action,Adventure,Drama,,,,,,PG-13
Clash of the Titans ,Louis Leterrier,106,"Liam Neeson, Jason Flemyng, Alexa Davalos",famous line|hand to hand combat|kraken|rape|zeus,English,USA,2010,5.8,Action,Adventure,Fantasy,,,,,,PG-13
Dante's Peak ,Roger Donaldson,108,"Jamie Renée Smith, Grant Heslov, Tzi Ma",ash|escape|lava|mayor|volcano,English,USA,1997,5.8,Action,Adventure,Thriller,,,,,,PG-13
The Green Hornet ,Michel Gondry,119,"Christoph Waltz, Tom Wilkinson, Chad L. Coleman",heir|kung fu|party|playboy|superhero,English,USA,2011,5.8,Action,Comedy,Crime,Sci-Fi,Thriller,,,,PG-13
Allegiant ,Robert Schwentke,120,"Naomi Watts, Theo James, Zoë Kravitz",based on young adult novel|dystopia|genetic experimentation|strong female character|strong female lead,English,USA,2016,5.8,Action,Adventure,Mystery,Sci-Fi,Thriller,,,,PG-13
Around the World in 80 Days ,Frank Coraci,120,"Jim Broadbent, Steve Coogan, Cécile De France",19th century|around the world|inventor|martial arts|train,English,USA,2004,5.8,Action,Adventure,Comedy,,,,,,PG
The Three Musketeers ,Paul W.S. Anderson,110,"Milla Jovovich, Logan Lerman, Orlando Bloom",box office flop|cardinal richelieu|critically bashed|duel|musketeer,English,Germany,2011,5.8,Action,Adventure,Romance,,,,,,PG-13
Daylight ,Rob Cohen,114,"Sylvester Stallone, Viggo Mortensen, Amy Brenneman",collapsing tunnel|explosion|new jersey|tunnel|weimaraner,English,USA,1996,5.8,Action,Adventure,Drama,Thriller,,,,,PG-13
Nine ,Rob Marshall,118,"Fergie, Elio Germano, Andrea Di Stefano",based on stage musical based on film|child abuse|film director|italian|mistress,English,USA,2009,5.8,Drama,Musical,Romance,,,,,,PG-13
Babe: Pig in the City ,George Miller,97,"Adam Goldberg, Elizabeth Daily, Glenne Headly",animal|farm|farmer|hotel|pig,English,Australia,1998,5.8,Adventure,Comedy,Drama,Family,Fantasy,,,,G
Journey 2: The Mysterious Island ,Brad Peyton,94,"Josh Hutcherson, Dwayne Johnson, Kristin Davis",gold|hurricane|island|mountain|mysterious island,English,USA,2012,5.8,Action,Adventure,Comedy,Family,Fantasy,Sci-Fi,,,PG
The League of Extraordinary Gentlemen ,Stephen Norrington,110,"Jason Flemyng, Max Ryan, Tony Curran",box office flop|captain nemo|dorian gray|invisible man|steampunk,English,USA,2003,5.8,Action,Adventure,Fantasy,Sci-Fi,,,,,PG-13
xXx ,Rob Cohen,132,"Vin Diesel, Eve, Leila Arcieri",agent|nsa|nsa agent|prague|russian,English,USA,2002,5.8,Action,Adventure,Thriller,,,,,,PG-13
Battle Los Angeles ,Jonathan Liebesman,116,"Noel Fisher, Jim Parrack, Ramon Rodriguez",alien|extraterrestrial|invasion|marine|mission,English,USA,2011,5.8,Action,Sci-Fi,,,,,,,PG-13
Hard Rain ,Mikael Salomon,97,"Morgan Freeman, Minnie Driver, Randy Quaid",dam|flood|money|police|sheriff,English,USA,1998,5.8,Action,Crime,Drama,Thriller,,,,,R
Chicken Little ,Mark Dindal,81,"Catherine O'Hara, Fred Willard, Amy Sedaris",alien invasion|chicken|fish|friend|panic,English,USA,2005,5.8,Adventure,Animation,Comedy,Family,Sci-Fi,,,,G
Deep Blue Sea ,Renny Harlin,105,"LL Cool J, Michael Rapaport, Saffron Burrows",alzheimer's disease|experiment|human versus shark|research|underwater headquarters,English,USA,1999,5.8,Action,Sci-Fi,Thriller,,,,,,R
Stuck on You ,Bobby Farrelly,118,"Matt Damon, Terence Bernie Hines, Seymour Cassel",actor|conjoined twins|cook|internet|short order cook,English,USA,2003,5.8,Comedy,,,,,,,,PG-13
Semi-Pro ,Kent Alterman,99,"Will Ferrell, Maura Tierney, Matt Walsh",flint michigan|merger|michigan|nba|team,English,USA,2008,5.8,Comedy,Sport,,,,,,,R
The Fan ,Tony Scott,116,"Robert De Niro, Kurt Fuller, Ellen Barkin",baseball|fan|obsession|salesman|san francisco giants,English,USA,1996,5.8,Action,Drama,Sport,Thriller,,,,,R
The Break-Up ,Peyton Reed,106,"Jon Favreau, John Michael Higgins, Ann-Margret",art|break up|football video game|kitchen|talking to one's self in a mirror,English,USA,2006,5.8,Comedy,Drama,Romance,,,,,,PG-13
Mr. Deeds ,Steven Brill,96,"Steve Buscemi, Adam Sandler, Peter Gallagher",abbreviation in title|reporter|small town|sudden wealth|unknowing heir,English,USA,2002,5.8,Comedy,Romance,,,,,,,PG-13
Firewall ,Richard Loncraine,105,"Jimmy Bennett, Harrison Ford, Mary Lynn Rajskub",architect|bank|cayman islands|meeting|murder,English,USA,2006,5.8,Crime,Thriller,,,,,,,PG-13
G.I. Jane ,Ridley Scott,125,"Viggo Mortensen, Demi Moore, John Michael Higgins",feminism|hit in the crotch|kicked in the crotch|kicked in the testicles|navy,English,USA,1997,5.8,Action,Drama,War,,,,,,R
Into the Storm ,Steven Quale,89,"Matt Walsh, Alycia Debnam-Carey, Scott Lawrence",danger|graduation|storm|teenage boy|tornado,English,USA,2014,5.8,Action,Thriller,,,,,,,PG-13
Into the Blue ,John Stockwell,110,"Paul Walker, James Frain, Ashley Scott",bahamas|blood splatter|cocaine|hairy chest|shark,English,USA,2005,5.8,Action,Adventure,Crime,Thriller,,,,,PG-13
Gamer ,Mark Neveldine,95,"Gerard Butler, Logan Lerman, Alison Lohman",battle|convict|death|mind control|role playing,English,USA,2009,5.8,Action,Sci-Fi,Thriller,,,,,,R
Mary Reilly ,Stephen Frears,108,"Julia Roberts, Bronagh Gallagher, George Cole",19th century|butler|housemaid|laboratory|servant,English,USA,1996,5.8,Drama,Horror,Romance,Thriller,,,,,R
Journey to the Center of the Earth ,Eric Brevig,93,"Josh Hutcherson, Brendan Fraser, Anita Briem",cave|lost world|missing brother|mountain|venus flytrap,English,USA,2008,5.8,Action,Adventure,Family,Fantasy,Sci-Fi,,,,PG
All the Pretty Horses ,Billy Bob Thornton,220,"Matt Damon, Henry Thomas, Sam Shepard",1940s|cowboy|mexico|railway station|texas,English,USA,2000,5.8,Drama,Romance,Western,,,,,,PG-13
Brüno ,Larry Charles,81,"Bono, Elton John, Slash",austrian|fame|fashion|gay lead character|mockumentary,English,USA,2009,5.8,Comedy,,,,,,,,R
Cheaper by the Dozen ,Shawn Levy,94,"Tom Welling, Alyson Stoner, Bonnie Hunt",9 year old|house|illinois|new job|vomiting,English,USA,2003,5.8,Comedy,Family,,,,,,,PG
Made of Honor ,Paul Weiland,101,"Busy Philipps, Beau Garrett, Kevin Sussman",friend|love|maid|maid of honor|marriage,English,USA,2008,5.8,Comedy,Romance,,,,,,,PG-13
Gothika ,Mathieu Kassovitz,98,"Robert Downey Jr., Charles S. Dutton, Bernard Hill",memory|murder|patient|psychiatrist|the devil,English,USA,2003,5.8,Horror,Mystery,Thriller,,,,,,R
The Guilt Trip ,Anne Fletcher,95,"Miriam Margolyes, Tom Virtue, Julene Renee",cross country|love|mother son relationship|on the road|trip,English,USA,2012,5.8,Comedy,Drama,,,,,,,PG-13
Mickey Blue Eyes ,Kelly Makin,102,"Jeanne Tripplehorn, Burt Young, Vincent Pastore",auctioneer|fbi|mafia|mobster|painting,English,UK,1999,5.8,Comedy,Crime,Romance,,,,,,PG-13
Life or Something Like It ,Stephen Herek,103,"Angelina Jolie Pitt, Stockard Channing, James Gammon",football|homeless man|interview|psychic|reporter,English,USA,2002,5.8,Comedy,Romance,,,,,,,PG-13
Duplex ,Danny DeVito,89,"Justin Theroux, Amber Valletta, Harvey Fierstein",christmas|duplex|television|tenant|writer,English,USA,2003,5.8,Comedy,,,,,,,,PG-13
Just Visiting ,Jean-Marie Poiré,84,"Bridgette Wilson-Sampras, Matt Ross, John Aylward",alternate history|alternate timeline|flatulence|future time travel|time travel comedy,English,France,2001,5.8,Comedy,Fantasy,Sci-Fi,,,,,,PG-13
The Gunman ,Pierre Morel,115,"Ray Winstone, Mark Rylance, Jasmine Trinca",assassination|blood vomiting|death|hit squad|mercenary,English,USA,2015,5.8,Action,Crime,Drama,Mystery,Thriller,,,,R
Rush Hour ,,43,"Jon Foo, Aimee Garcia, Wendie Malick",,English,USA,,5.8,Action,Comedy,Crime,,,,,,TV-14
Species ,Roger Donaldson,108,"Natasha Henstridge, Marg Helgenberger, Jordan Lund",alien|interspecies sex|scientist|sexual attraction|train,English,USA,1995,5.8,Action,Horror,Sci-Fi,Thriller,,,,,R
The Nut Job ,Peter Lepeniotis,85,"Liam Neeson, Brendan Fraser, Sarah Gadon",bank robbery|heist|raccoon|rat|squirrel,English,Canada,2014,5.8,Adventure,Animation,Comedy,Family,,,,,PG
Splice ,Vincenzo Natali,104,"Sarah Polley, David Hewlett, Delphine Chanéac",dna|experiment|genetics|interspecies sex|scientist,English,Canada,2009,5.8,Drama,Horror,Sci-Fi,,,,,,R
The Borrowers ,Peter Hewitt,89,"Jim Broadbent, Bradley Pierce, Mark Williams",child's point of view|house|lawyer|real estate|washing machine,English,UK,1997,5.8,Adventure,Comedy,Family,Fantasy,,,,,PG
Timecop ,Peter Hyams,99,"Mia Sara, Bruce McGill, Gloria Reuben",cop|corrupt politician|future|senator|time travel,English,Canada,1994,5.8,Action,Crime,Sci-Fi,Thriller,,,,,R
Pride and Prejudice and Zombies ,Burr Steers,108,"Matt Smith, Bella Heathcote, Sam Riley",based on novel|damsel in distress|deception|england|zombie,English,USA,2016,5.8,Action,Horror,Romance,,,,,,PG-13
Freddy vs. Jason ,Ronny Yu,97,"Katharine Isabelle, Jason Ritter, Zack Ward",elm street|freddy krueger|jason voorhees|serial killer|slasher,English,USA,2003,5.8,Action,Horror,Thriller,,,,,,R
Final Destination 3 ,James Wong,86,"Chelan Simmons, Gina Holden, Crystal Lowe",amusement park|death|fate|premonition|roller coaster,English,Germany,2006,5.8,Horror,,,,,,,,R
Undercover Brother ,Malcolm D. Lee,86,"Dave Chappelle, Eddie Griffin, Chi McBride",african american|cadillac|disguise|secret agent|undercover,English,USA,2002,5.8,Action,Comedy,,,,,,,PG-13
What a Girl Wants ,Dennie Gordon,105,"Colin Firth, Oliver James, Kelly Preston",american|daughter|england|father|politician,English,USA,2003,5.8,Comedy,Drama,Family,Romance,,,,,PG
Cradle 2 the Grave ,Andrzej Bartkowiak,101,"Jet Li, Tom Arnold, DMX",camera shot from inside human body|diamond|evil man|heist|terrorism,English,USA,2003,5.8,Action,Crime,Drama,Thriller,,,,,R
Straw Dogs ,Rod Lurie,110,"Alexander Skarsgård, Laz Alonso, Rhys Coiro",gang rape|panties pulled down|rape|rape victim|sexual humiliation,English,USA,2011,5.8,Action,Drama,Thriller,,,,,,R
Jane Got a Gun ,Gavin O'Connor,98,"Natalie Portman, Noah Emmerich, Boyd Holbrook",brothel|death of husband|ex lover|haunted by the past|redemption,English,USA,2016,5.8,Action,Drama,Western,,,,,,R
Haywire ,Steven Soderbergh,93,"Channing Tatum, Michael Fassbender, Michael Angarano",die hard scenario|one woman army|rescue|soldier|super soldier,English,Ireland,2011,5.8,Action,Thriller,,,,,,,R
The Net ,Irwin Winkler,114,"Ken Howard, Jeremy Northam, Ray McKinnon",chat room|computer|computer hacker|identity|identity theft,English,USA,1995,5.8,Action,Crime,Drama,Mystery,Thriller,,,,PG-13
The Glass House ,Daniel Sackheim,106,"Chris Noth, Bruce Dern, Trevor Morgan",car|car accident|death|friend|glass,English,USA,2001,5.8,Crime,Drama,Mystery,Thriller,,,,,PG-13
Mad Money ,Callie Khouri,104,"Stephen Root, Ted Danson, Roger Cross",bank|federal reserve bank|money|security guard|shredder,English,USA,2008,5.8,Comedy,Crime,Thriller,,,,,,PG-13
Molly ,John Duigan,102,"Elaine Hendrix, Jill Hennessy, Sarah Wynter",autism|experimental surgery|female nudity|forename as title|regression,English,USA,1999,5.8,Comedy,Drama,Romance,,,,,,PG-13
The Best Little Whorehouse in Texas ,Colin Higgins,114,"Dolly Parton, Barry Corbin, Dom DeLuise",chicken|governor|locker room|sheriff|texas,English,USA,1982,5.8,Comedy,Musical,,,,,,,R
Mortal Kombat ,Paul W.S. Anderson,101,"Christopher Lambert, Cary-Hiroyuki Tagawa, Bridgette Wilson-Sampras",based on video game|island|mortal kombat|tournament|warrior,English,USA,1995,5.8,Action,Adventure,Fantasy,Sci-Fi,Thriller,,,,PG-13
The Last Song ,Julie Anne Robinson,107,"Kelly Preston, Bobby Coleman, Melissa Ordway",beach|fire|love|pianist|summer,English,USA,2010,5.8,Drama,Family,Music,Romance,,,,,PG
Return to Never Land ,Robin Budd,72,"Roger Rees, Rob Paulsen, Spencer Breslin",1940s|gang that lives together|outlaw gang|rescue|sequel,English,USA,2002,5.8,Adventure,Animation,Family,Fantasy,,,,,G
You Again ,Andy Fickman,105,"Jamie Lee Curtis, James Wolk, Christine Lakin",dancing|dog|flight|hostility|travel,English,USA,2010,5.8,Comedy,Family,Romance,,,,,,PG
Monte Carlo ,Thomas Bezucha,109,"Leighton Meester, Luke Bracey, Brett Cullen",cell phone|hotel|misunderstanding|monte carlo|young woman,English,Hungary,2011,5.8,Adventure,Comedy,Family,Romance,,,,,PG
Paparazzi ,Paul Abascal,84,"Cole Hauser, Tom Hollander, Kelly Carlson",actor|coma|movie star|paparazzi|revenge,English,USA,2004,5.8,Action,Crime,Drama,Thriller,,,,,PG-13
Zambezia ,Wayne Thornley,83,"Leonard Nimoy, Phil LaMarr, Noureen DeWulf",bird|city name in title|falcon|one word title|place name in title,English,South Africa,2012,5.8,Adventure,Animation,Comedy,Family,,,,,G
Observe and Report ,Jody Hill,86,"Collette Wolfe, Celia Weston, Dan Bakkedahl",male pubic hair|mall|police detective|pubic hair|security guard,English,USA,2009,5.8,Comedy,Crime,Drama,,,,,,R
Conan the Destroyer ,Richard Fleischer,103,"Mako, Olivia d'Abo, Grace Jones",gods|princess|queen|rescue|wizard,English,USA,1984,5.8,Action,Adventure,Fantasy,,,,,,PG
The Adventures of Elmo in Grouchland ,Gary Halvorson,73,"Vanessa Williams, Kevin Clash, Caroll Spinney",based on tv series|blanket|box office flop|rescue|sesame street,English,USA,1999,5.8,Adventure,Comedy,Family,Fantasy,Musical,,,,G
Khumba ,Anthony Silverston,85,"Liam Neeson, Steve Buscemi, Loretta Devine",herd|ostrich|waterhole|wildebeest|zebra,English,South Africa,2013,5.8,Adventure,Animation,Family,,,,,,Not Rated
Earth to Echo ,Dave Green,91,"Teo Halm, Ella Wahlestedt, Jason Gray-Stanford",alien|bar|construction worker|no opening credits|no title at beginning,English,USA,2014,5.8,Adventure,Family,Sci-Fi,,,,,,PG
54 ,Mark Christopher,121,"Salma Hayek, Ellen Albertini Dow, Sela Ward",angel dust the drug|disco|new york city|quaalude|reference to princess grace of monaco,English,USA,1998,5.8,Drama,Music,,,,,,,R
Just Wright ,Sanaa Hamri,100,"Common, Laz Alonso, Mehcad Brooks",basketball|basketball player|nba|physical therapist|therapist,English,USA,2010,5.8,Comedy,Romance,Sport,,,,,,PG
Heaven Is for Real ,Randall Wallace,99,"Jacob Vargas, Connor Corum, Rob Moran",based on true story|christ|christian|near death experience|pastor,English,USA,2014,5.8,Biography,Drama,,,,,,,PG
St. Trinian's ,Oliver Parker,100,"Lily Cole, Rupert Everett, Tamsin Egerton",2000s|female protagonist|reward|school|st trinian's,English,UK,2007,5.8,Comedy,,,,,,,,PG-13
Saw V ,David Hackl,95,"Julie Benz, Costas Mandylor, Scott Patterson",blood splatter|jigsaw|nazi|serial killer|swastika tattoo,English,USA,2008,5.8,Horror,Mystery,,,,,,,R
September Dawn ,Christopher Cain,111,"Jon Gries, Taylor Handley, Trent Ford",massacre|mormon|settler|utah|wagon train,,USA,2007,5.8,Drama,History,Romance,Western,,,,,R
She's All That ,Robert Iscove,95,"Paul Walker, Clea DuVall, Kieran Culkin",bet|friend|high school|prom|prom queen,English,USA,1999,5.8,Comedy,Romance,,,,,,,PG-13
Friday After Next ,Marcus Raboy,85,"John Witherspoon, Mike Epps, Katt Williams",apartment|christmas|christmas present|rent|security guard,English,USA,2002,5.8,Comedy,Drama,,,,,,,R
A Low Down Dirty Shame ,Keenen Ivory Wayans,100,"Jada Pinkett Smith, Salli Richardson-Whitfield, Charles S. Dutton",drugs|ex cop|gun fu|machismo|shootout,English,USA,1994,5.8,Action,Comedy,Crime,,,,,,R
"The Goods: Live Hard, Sell Hard ",Neal Brennan,89,"Rob Riggle, Noureen DeWulf, Charles Napier",fourth of july|looking at one's self in a mirror|mirror|sex toy|young version of character,English,USA,2009,5.8,Comedy,,,,,,,,R
Get Over It ,Tommy O'Haver,87,"Mila Kunis, Kirsten Dunst, Carmen Electra",basketball|dancer|high school|love triangle|shakespeare's a midsummer night's dream,English,USA,2001,5.8,Comedy,Romance,,,,,,,PG-13
Teacher's Pet ,Timothy Björklund,74,"Nathan Lane, Kelsey Grammer, Jerry Stiller",dog|florida|mad scientist|school|teacher,English,USA,2004,5.8,Animation,Comedy,Family,Fantasy,Musical,,,,PG
The Reef ,Andrew Traucki,94,"Damian Walshe-Howling, Gyton Grantley, Adrienne Pickering",boat|great white shark|killing an animal|shark|underwater,English,Australia,2010,5.8,Horror,Thriller,,,,,,,R
Detention ,Joseph Kahn,93,"Josh Hutcherson, Shanley Caswell, Parker Bagley",blood splatter|detention|high school|overalls|reference to c. thomas howell,English,USA,2011,5.8,Comedy,Horror,Sci-Fi,,,,,,R
The Christmas Candle ,John Stephenson,100,"Samantha Barks, Hans Matheson, Lesley Manville",angel|candle|christmas|miracle|village,English,UK,2013,5.8,Drama,Family,,,,,,,PG
Criminal Activities ,Jackie Earle Haley,94,"Rex Baker, Edi Gathegi, Travis Aaron Wade",african american gangster|falling to death|in over one's head|murder|surveillance,English,USA,2015,5.8,Crime,Drama,Thriller,,,,,,
School Daze ,Spike Lee,121,"Tisha Campbell-Martin, Ossie Davis, Bill Nunn",beauty salon|black college|college|fraternity|sorority,English,USA,1988,5.8,Comedy,Drama,Musical,,,,,,R
Novocaine ,David Atkins,95,"Chelcie Ross, Lynne Thigpen, Polly Noonan",dentist|drugs|murder|sex|sunflower,English,USA,2001,5.8,Comedy,Crime,Drama,Thriller,,,,,R
Men of War ,Perry Lang,76,"Catherine Bell, Kevin Tighe, Tim Guinee",cockney accent|fight|island|machismo|mercenary,English,USA,1994,5.8,Action,Drama,Thriller,,,,,,R
Song One ,Kate Barker-Froyland,86,"Anne Hathaway, Shawn Parsons, Li Jun Li",musician|number in title|recording|sibling,English,USA,2014,5.8,Drama,Music,,,,,,,PG-13
Paranormal Activity 3 ,Henry Joost,94,"Johanna Braddy, Sprague Grayden, Christopher Nicholas Smith",animate object|imaginary friend|reference to macgyver|whispering|woman wearing only a man's shirt,English,USA,2011,5.8,Horror,,,,,,,,R
Falcon Rising ,Ernie Barbarash,103,"Michael Jai White, Michael J. Morris, Lateef Crowder",,English,USA,2014,5.8,Action,Adventure,,,,,,,R
Love Stinks ,Jeff Franklin,94,"Ivana Milicevic, Tyra Banks, Bridgette Wilson-Sampras",black comedy|marriage|marriage proposal|not taking no for an answer|obsessive woman,English,USA,1999,5.8,Comedy,,,,,,,,R
The Last Time I Committed Suicide ,Stephen Kay,92,"Keanu Reeves, Marg Helgenberger, Gretchen Mol",1940s|female bare foot|picket fence|tire|vomiting,English,USA,1997,5.8,Biography,Drama,,,,,,,R
The Divide ,Xavier Gens,122,"Michael Biehn, Lauren German, Rosanna Arquette",doggystyle sex|rough sex|sodomy|torture|violent sex,English,Germany,2011,5.8,Drama,Sci-Fi,Thriller,,,,,,R
Never Back Down 2: The Beatdown ,Michael Jai White,90,"Michael Jai White, Alex Meraz, Jillian Murray",bad cop|college|second part|sequel|wrestler,English,USA,2011,5.8,Action,Drama,Sport,,,,,,R
Christmas Mail ,John Murlowski,89,"Ashley Scott, Piper Mackenzie Harris, Lochlyn Munro",boss|holiday|letter|north pole|santa,English,USA,2010,5.8,Comedy,Drama,Family,Romance,,,,,TV-PG
The Calling ,Jason Stone,108,"Topher Grace, Ellen Burstyn, Christopher Heyerdahl",bouquet|house fire|praying|serial killer|tied to a chair,English,USA,2014,5.8,Thriller,,,,,,,,R
Chicken Tikka Masala ,Harmage Singh Kalirai,90,"Saeed Jaffrey, Zohra Segal, Shobu Kapoor",acceptance|coming out to family|gay|large family|wedding,English,UK,2005,5.8,Comedy,Drama,Romance,,,,,,
Saint John of Las Vegas ,Hue Rhodes,85,"Peter Dinklage, Steve Buscemi, Romany Malco",city name in title|male frontal nudity|place name in title,English,USA,2009,5.8,Comedy,Drama,,,,,,,R
One to Another ,Pascal Arnold,95,"Karl E. Landler, Lizzie Brocheré, Pierre Perrier",fellatio|female frontal nudity|male frontal nudity|nude sunbathing|orgy,French,France,2006,5.8,Drama,,,,,,,,Unrated
The To Do List ,Maggie Carey,104,"Donald Glover, Alia Shawkat, Scott Porter",feces in a swimming pool|female vomiting|high school|lifeguard|male objectification,English,USA,2013,5.8,Comedy,Romance,,,,,,,R
Amigo ,John Sayles,124,"Brian Lee Franklin, John Arcilla, Ronnie Lazaro",american|filipino|friendship|guerrilla army|village,English,USA,2010,5.8,Drama,War,,,,,,,R
Hits ,David Cross,96,"Jason Ritter, Matt Walsh, Amy Sedaris",courtroom|independent film|internet|small town|youtube,English,USA,2014,5.8,Comedy,Drama,,,,,,,
Proud ,Mary Pat Kelly,87,"Aidan Quinn, Ossie Davis, Janet Hubert",,English,USA,2004,5.8,Drama,,,,,,,,PG
Johnny Suede ,Tom DiCillo,97,"Brad Pitt, Tina Louise, Nick Cave",idol|musician|vomiting|watching television|wyoming,English,Switzerland,1991,5.8,Comedy,Music,Romance,,,,,,R
