movie_title,director_name,duration,actors,plot_keywords,language,country,title_year,imdb_score,Genre1,Genre2,Genre3,Genre4,Genre5,Genre6,Genre7,Genre8,content_rating
Arlington Road ,Mark Pellington,117,"Jeff Bridges, Spencer Treat Clark, Hope Davis",death|fbi|fbi agent|neighbor|professor,English,USA,1999,7.2,Crime,Drama,Thriller,,,,,,R
Team America: World Police ,Trey Parker,98,"Jeremy Shada, Maurice LaMarche, Trey Parker",actor|arab stereotype|broadway|terrorist|vomiting,English,USA,2004,7.2,Action,Comedy,,,,,,,R
Let Me In ,Matt Reeves,116,"Chloë Grace Moretz, Dylan Minnette, Kodi Smit-McPhee",blood|boy|night|school|vampire,English,UK,2010,7.2,Drama,Fantasy,Horror,Mystery,,,,,R
Everybody's Fine ,Kirk Jones,99,"Robert De Niro, James Frain, Brendan Sexton III",bus trip|parental love|retirement|surprise visit|train ride,English,USA,2009,7.2,Adventure,Drama,,,,,,,PG-13
Chasing Mavericks ,Michael Apted,116,"Gerard Butler, Abigail Spencer, Leven Rambin",box office flop|no opening credits|surfing|two word title|year 1987,English,USA,2012,7.2,Biography,Drama,Sport,,,,,,PG
The Doombolt Chase ,,30,"Peter Vaughan, George Coulouris, Ewen Solon",,English,UK,,7.2,Drama,Family,,,,,,,
Hands of Stone ,Jonathan Jakubowicz,105,"Robert De Niro, Jurnee Smollett-Bell, Edgar Ramírez",boxer|boxing|three word title,English,Panama,2016,7.2,Action,Biography,Drama,Sport,,,,,R
Scream ,Wes Craven,103,"David Arquette, W. Earl Brown, Roger Jackson",mask|mystery killer|slasher|teenage girl|telephone,English,USA,1996,7.2,Horror,Mystery,,,,,,,R
Catch-22 ,Mike Nichols,122,"Bob Newhart, Bob Balaban, Martin Balsam",catch 22|friend|insanity|kneed in the groin|military,English,USA,1970,7.2,Comedy,Drama,War,,,,,,R
Steve Jobs ,Danny Boyle,122,"Kate Winslet, Michael Fassbender, Michael Stuhlbarg",apple computer|box office flop|computer|dialogue driven|father daughter relationship,English,UK,2015,7.2,Biography,Drama,,,,,,,R
The Salton Sea ,D.J. Caruso,103,"Adam Goldberg, Meat Loaf, Anthony LaPaglia",male in shower|murder|neighbor neighbor relationship|remote control car|sex scene,English,USA,2002,7.2,Crime,Drama,Mystery,Thriller,,,,,R
Metallica Through the Never ,Nimród Antal,93,"James Hetfield, Mackenzie Gray, Lars Ulrich",headbanger|metallica|roadie|song in title|standing on the roof of a car,English,USA,2013,7.2,Music,,,,,,,,R
Day of the Dead ,George A. Romero,87,"Greg Nicotero, John Amplas, Joseph Pilato",bunker|experiment|military|research|scientist,English,USA,1985,7.2,Horror,,,,,,,,Unrated
Pitch Perfect ,Jason Moore,112,"Anna Kendrick, Hana Mae Lee, Ben Platt",a cappella|competition|dj|female protagonist|lesbian,English,USA,2012,7.2,Comedy,Music,Romance,,,,,,PG-13
Vicky Cristina Barcelona ,Woody Allen,96,"Scarlett Johansson, Kevin Dunn, Christopher Evan Welch",art|artist|painter|sex|summer,English,Spain,2008,7.2,Drama,Romance,,,,,,,PG-13
White Oleander ,Peter Kosminsky,109,"Patrick Fugit, Cole Hauser, Marc Donato",california|foster home|love|oleander|prison,English,USA,2002,7.2,Drama,,,,,,,,PG-13
Remember Me ,Allen Coulter,113,"Robert Pattinson, Lena Olin, Ruby Jerins",binge drinking|new york|new york city|september 11 2001|suicide,English,USA,2010,7.2,Drama,Romance,,,,,,,PG-13
Highlander ,Russell Mulcahy,110,"Christopher Lambert, Jon Polito, Celia Imrie",combat|head cut off|immortal|scotland|swordsman,English,UK,1986,7.2,Action,Adventure,Fantasy,,,,,,R
Things We Lost in the Fire ,Susanne Bier,118,"Alison Lohman, Omar Benson Miller, Robin Weigert",best friend|dinner|garage|narcotics anonymous|recovery,English,USA,2007,7.2,Drama,,,,,,,,R
What's Love Got to Do with It ,Brian Gibson,118,"Rae'Ven Kelly, Virginia Capers, Dororthy Thorton",abusive husband|love|singer|tina turner|violence,English,USA,1993,7.2,Biography,Drama,Music,,,,,,R
Love & Basketball ,Gina Prince-Bythewood,124,"Alfre Woodard, Sanaa Lathan, Omar Epps",basketball movie|female basketball player|high school|nba|title directed by female,English,USA,2000,7.2,Drama,Romance,Sport,,,,,,PG-13
Whatever Works ,Woody Allen,92,"Larry David, Michael McKean, Conleth Hill",atheist|limp|quantum mechanics|religion|runaway,English,USA,2009,7.2,Comedy,Romance,,,,,,,PG-13
Never Let Me Go ,Mark Romanek,103,"Andrew Garfield, Charlie Rowe, Charlotte Rampling",boarding school|childhood|love|love triangle|organ donation,English,UK,2010,7.2,Drama,Romance,Sci-Fi,,,,,,R
District B13 ,Pierre Morel,84,"David Belle, Cyril Raffaelli, Dany Verissimo-Petit",bomb|gang|police|sister|undercover cop,French,France,2004,7.2,Action,Crime,Thriller,,,,,,R
Born on the Fourth of July ,Oliver Stone,145,"Tom Cruise, Tom Berenger, Stephen Baldwin",desert|drunkenness|religious mother|strict mother|vietnam war,English,USA,1989,7.2,Biography,Drama,War,,,,,,R
Seven Psychopaths ,Martin McDonagh,110,"Abbie Cornish, Gabourey Sidibe, Michael Stuhlbarg",dognapping|gangster|misfiring gun|screenwriter|shih tzu,English,UK,2012,7.2,Comedy,Crime,,,,,,,R
10 Things I Hate About You ,Gil Junger,97,"Joseph Gordon-Levitt, Heath Ledger, Andrew Keegan",dating|protective father|school|shrew|teen movie,English,USA,1999,7.2,Comedy,Drama,Romance,,,,,,PG-13
The Mist ,Frank Darabont,126,"Toby Jones, Alexa Davalos, Jeffrey DeMunn",desperation|fog|giant insect|survival|survival horror,English,USA,2007,7.2,Horror,,,,,,,,R
Brother ,Takeshi Kitano,114,"Omar Epps, Tatyana Ali, James Shigeta",gang|gangster|subjective camera|written and directed by cast member|yakuza,English,USA,2000,7.2,Crime,Drama,Thriller,,,,,,R
Gremlins ,Joe Dante,106,"Phoebe Cates, Harry Carey Jr., Zach Galligan",bright light|midnight|pet|small town|water,English,USA,1984,7.2,Comedy,Fantasy,Horror,,,,,,PG
Trash ,Stephen Daldry,114,"Wagner Moura, Selton Mello, Daniel Zettel",bible|key|poverty|slum|wallet,Portuguese,UK,2014,7.2,Adventure,Crime,Drama,Mystery,Thriller,,,,R
Major League ,David S. Ward,107,"Corbin Bernsen, Tom Berenger, Rene Russo",cleveland indians|league|manager|owner|team,English,USA,1989,7.2,Comedy,Sport,,,,,,,R
The Outsiders ,Francis Ford Coppola,114,"Tom Cruise, William Smith, Tom Waits",dysfunctional family|gang|greaser|holding someone's head underwater|rivalry,English,USA,1983,7.2,Crime,Drama,,,,,,,PG-13
The Dead Zone ,David Cronenberg,103,"Tom Skerritt, Herbert Lom, Anthony Zerbe",car accident|coma|evil politician|psychic|vision,English,USA,1983,7.2,Horror,Sci-Fi,Thriller,,,,,,R
A Better Life ,Chris Weitz,98,"Demián Bichir, Eddie 'Piolin' Sotelo, Robert Peters",gang|gardener|money|police|truck,English,USA,2011,7.2,Drama,Romance,,,,,,,PG-13
Nicholas Nickleby ,Douglas McGrath,132,"Charlie Hunnam, Anne Hathaway, Jim Broadbent",boy|boys' school|death|friend|orphan,English,UK,2002,7.2,Drama,Romance,,,,,,,PG
Owning Mahowny ,Richard Kwietniowski,104,"Philip Seymour Hoffman, Minnie Driver, Maury Chaykin",bank|bank fraud|bank manager|gambling|toronto,English,Canada,2003,7.2,Crime,Drama,Thriller,,,,,,R
The Savages ,Tamara Jenkins,114,"Philip Seymour Hoffman, David Zayas, Gbenga Akinnagbe",arizona|dementia|married man|sun city arizona|writing,English,USA,2007,7.2,Comedy,Drama,,,,,,,R
The Lost Boys ,Joel Schumacher,97,"Dianne Wiest, Jami Gertz, Jason Patric",1980s|california|death|small town|vampire,English,USA,1987,7.2,Comedy,Fantasy,Horror,,,,,,R
Silmido ,Woo-Suk Kang,135,"Yu-mi Jeong, Sung-kee Ahn, Kyung-gu Sol",based on book|based on true story|rape|title spoken by character,Korean,South Korea,2003,7.2,Action,Drama,,,,,,,
Quo Vadis ,Mervyn LeRoy,171,"Peter Ustinov, Deborah Kerr, Robert Taylor",christian|emperor|general|hostage|nero,English,USA,1951,7.2,Biography,Drama,History,Romance,,,,,Passed
It's Kind of a Funny Story ,Anna Boden,101,"Zoë Kravitz, Jeremy Davies, Jim Gaffigan",based on novel|depression|psychiatric ward|suicide attempt|therapy,English,USA,2010,7.2,Comedy,Drama,Romance,,,,,,PG-13
Made in Dagenham ,Nigel Cole,113,"Bob Hoskins, Robbie Kay, Sally Hawkins",equal pay|machinist|minister|protest|sex,English,UK,2010,7.2,Biography,Comedy,Drama,History,,,,,R
Restless ,Edward Hall,180,"Rufus Sewell, Hayley Atwell, Charlotte Rampling",espionage|motel|mother son relationship|murder disguised as suicide|shot in the head,English,UK,2012,7.2,Drama,Romance,,,,,,,
Narc ,Joe Carnahan,105,"Jason Patric, Chi McBride, Alan Van Sprang",blood splatter|cover up|murder|police shootout|undercover,English,USA,2002,7.2,Crime,Drama,Mystery,Thriller,,,,,R
Harry Brown ,Daniel Barber,97,"Joseph Gilgun, Jack O'Connell, Sean Harris",bayonet|death|police|self defense|widower,English,UK,2009,7.2,Action,Crime,Drama,Thriller,,,,,R
"Definitely, Maybe ",Adam Brooks,112,"Ryan Reynolds, Sakina Jaffrey, Paulina Gerzon",college|daughter|girl|sex|wisconsin,English,Germany,2008,7.2,Comedy,Drama,Romance,,,,,,PG-13
Desperado ,Robert Rodriguez,104,"Quentin Tarantino, Steve Buscemi, Salma Hayek",crushed by a car|female frontal nudity|female nudity|female rear nudity|one against many,English,USA,1995,7.2,Action,Crime,Thriller,,,,,,R
The Descent ,Neil Marshall,100,"MyAnna Buring, Shauna Macdonald, Craig Conway",cave|expedition|friendship between women|group of friends|survival horror,English,UK,2005,7.2,Adventure,Horror,Thriller,,,,,,R
Mother and Child ,Rodrigo García,125,"Naomi Watts, Jimmy Smits, Carla Gallo",adoption|baby|girl|lawyer|sex,English,USA,2009,7.2,Drama,Romance,,,,,,,R
Two Lovers and a Bear ,Kim Nguyen,96,"Gordon Pinsent, Justin Edward Seale, John Ralston",,English,Canada,2016,7.2,Drama,Romance,,,,,,,
The Four Seasons ,Alan Alda,107,"Rita Moreno, Len Cariou, Sandy Dennis",directed by star|friendship|reference to isaac newton|skinny dipping|written and directed by cast member,English,USA,1981,7.2,Comedy,Drama,,,,,,,PG
The Andromeda Strain ,Robert Wise,115,"David Wayne, Paula Kelly, Eric Christmas",alien|baby|new mexico|satellite|scientist,English,USA,1971,7.2,Sci-Fi,Thriller,,,,,,,G
The Messenger ,Oren Moverman,105,"Steve Buscemi, Yaya DaCosta, Eamonn Walker",captain|casualty notification|casualty notification team|sergeant|staff sergeant,English,USA,2009,7.2,Drama,Romance,War,,,,,,R
Mallrats ,Kevin Smith,123,"Ethan Suplee, Jason Mewes, Joey Lauren Adams",comic|ex girlfriend|jay and silent bob|mall|teenager,English,USA,1995,7.2,Comedy,Romance,,,,,,,R
Grease ,Randal Kleiser,110,"Olivia Newton-John, Stockard Channing, Sid Caesar",automobile racing|boyfriend girlfriend relationship|high school|wrestling|year 1959,English,USA,1978,7.2,Musical,Romance,,,,,,,PG-13
Escape from New York ,John Carpenter,106,"Donald Pleasence, Adrienne Barbeau, Tom Atkins",1990s|police|prison|rescue|year 1997,English,UK,1981,7.2,Action,Sci-Fi,,,,,,,R
The Virgin Suicides ,Sofia Coppola,90,"Kirsten Dunst, Kathleen Turner, Scott Glenn",catholic|five sisters|isolation|school|suicide,English,USA,1999,7.2,Drama,Romance,,,,,,,R
Shattered Glass ,Billy Ray,99,"Hayden Christensen, Rosario Dawson, Cas Anvar",fabricated facts|journalist|stephen glass|the new republic|writer,English,USA,2003,7.2,Drama,History,,,,,,,PG-13
11:14 ,Greg Marcks,85,"Henry Thomas, Barbara Hershey, Shawn Hatosy",convenience store|multiple perspectives|murder|paramedic|van,English,USA,2003,7.2,Comedy,Crime,Drama,,,,,,R
A Shine of Rainbows ,Vic Sarin,101,"Connie Nielsen, Aidan Quinn, John Bell",island|love|new home|orphan|rainbow,English,Canada,2009,7.2,Drama,Family,,,,,,,PG
Chariots of Fire ,Hugh Hudson,125,"Alice Krige, Ben Cross, John Gielgud",athlete|jew|missionary|olympic games|race,English,UK,1981,7.2,Biography,Drama,Sport,,,,,,PG
Le Havre ,Aki Kaurismäki,93,"Jean-Pierre Léaud, Kati Outinen, Jean-Pierre Darroussin",bar|container|illegal immigrant|neighbor|shoe shiner,French,Finland,2011,7.2,Comedy,Drama,,,,,,,Not Rated
"20,000 Leagues Under the Sea ",Richard Fleischer,127,"James Mason, Robert J. Wilke, Paul Lukas",captain|expedition|sea|submarine|whale,English,USA,1954,7.2,Adventure,Drama,Family,Fantasy,Sci-Fi,,,,Approved
The Apostle ,Robert Duvall,134,"John Beasley, Todd Allen, June Carter Cash",church|louisiana|minister|preacher|texas,English,USA,1997,7.2,Drama,,,,,,,,PG-13
Diner ,Barry Levinson,110,"Steve Guttenberg, Daniel Stern, Ellen Barkin",baltimore colts|diner|marriage|salesman|wedding,English,USA,1982,7.2,Comedy,Drama,,,,,,,R
Of Gods and Men ,Xavier Beauvois,122,"Lambert Wilson, Michael Lonsdale, Olivier Rabourdin",catholic church|community|monastery|monk|terrorist,French,France,2010,7.2,Drama,,,,,,,,PG-13
Out of the Blue ,Dennis Hopper,94,"Raymond Burr, Don Gordon, Jim Byrnes",explosion|hitchhiking|punk|trauma|truck driver,English,Canada,1980,7.2,Drama,,,,,,,,R
Sleep Tight ,Jaume Balagueró,102,"Luis Tosar, Tony Corvillo, Marta Etura",apartment|concierge|girl|hitchcockian|stalking,Spanish,Spain,2011,7.2,Drama,Horror,Thriller,,,,,,Not Rated
The Names of Love ,Michel Leclerc,100,"Sara Forestier, Jacques Gamblin, Zinedine Soualem",activist|promiscuous daughter|promiscuous woman|sex in a bed|voyeurism,French,France,2010,7.2,Comedy,Drama,Romance,,,,,,R
Fast Times at Ridgemont High ,Amy Heckerling,90,"Jennifer Jason Leigh, Judge Reinhold, Vincent Schiavelli",break up|california|high school|surfer|teacher,English,USA,1982,7.2,Comedy,Drama,,,,,,,X
Tango ,Carlos Saura,115,"Mía Maestro, Juan Luis Galiardo, Miguel Ángel Solá",dancer|director|love|musical filmmaking|tango,Spanish,Spain,1998,7.2,Drama,Musical,,,,,,,PG-13
Paa ,R. Balki,133,"Vidya Balan, Abhishek Bachchan, Paresh Rawal",adult actor playing minor|politician|progeria|reference to spiderman|school,Hindi,India,2009,7.2,Comedy,Drama,,,,,,,
The Full Monty ,Peter Cattaneo,91,"Tom Wilkinson, Mark Addy, Lesley Sharp",dole|male stripper|northern england|steel worker|unemployment,English,UK,1997,7.2,Comedy,Drama,Music,,,,,,R
Adam ,Max Mayer,99,"Peter Gallagher, Terry Walters, Amy Irving",apartment|asperger's syndrome|children|teacher|writer,English,USA,2009,7.2,Drama,Romance,,,,,,,PG-13
Beginners ,Mike Mills,105,"Goran Visnjic, Lou Taylor Pucci, Mary Page Keller",actress|cancer|death|french|gay relationship,English,USA,2010,7.2,Comedy,Drama,Romance,,,,,,R
Dave Chappelle's Block Party ,Michel Gondry,100,"Common, Dave Chappelle, Lauryn Hill",block party|marching band|neighborhood|new york city|tyrannosaurus rex,English,USA,2005,7.2,Comedy,Documentary,Music,,,,,,R
Love's Abiding Joy ,Michael Landon Jr.,87,"William Morgan Sheppard, Kevin Gage, Brianna Brown",19th century|faith|mayor|ranch|sheriff,,USA,2006,7.2,Drama,Family,Western,,,,,,PG
Timecrimes ,Nacho Vigalondo,66,"Karra Elejalde, Nacho Vigalondo, Bárbara Goenaga",binoculars|hitchcockian|scissors|time machine|woods,Spanish,Spain,2007,7.2,Horror,Mystery,Sci-Fi,Thriller,,,,,R
Mi America ,Robert Fontaine,125,"Michael Derek, Arturo Castro, Brad Lee Wind",,English,USA,2015,7.2,Crime,Drama,,,,,,,R
Smoke Signals ,Chris Eyre,89,"Michael Greyeyes, Irene Bedard, Gary Farmer",family abandonment|fire|loss of father|native american protagonist|native american reservation,English,Canada,1998,7.2,Comedy,Drama,,,,,,,PG-13
Winter's Bone ,Debra Granik,100,"Jennifer Lawrence, Shelley Waggener, Lauren Sweetser",bail|crystal meth|family relationships|female protagonist|search for father,English,USA,2010,7.2,Drama,,,,,,,,R
Brotherly Love ,Jamal Hill,89,"Logan Browning, Adam Ratcliffe, Faizon Love",basketball|burglary|police|robbery|teenage girl,English,USA,2015,7.2,Drama,,,,,,,,R
Nowhere Boy ,Sam Taylor-Johnson,98,"Kristin Scott Thomas, Ophelia Lovibond, Anne-Marie Duff",1960s|childhood|friendship|love|the beatles,English,UK,2009,7.2,Biography,Drama,Music,,,,,,R
Deadline - U.S.A. ,Richard Brooks,87,"Humphrey Bogart, Jim Backus, Kim Hunter",editor|gangster|newspaper|organized crime|press,English,USA,1952,7.2,Crime,Drama,Film-Noir,,,,,,
Caramel ,Nadine Labaki,95,"Yasmine Al Massri, Adel Karam, Nadine Labaki",caramel|friendship|police|secret|suitor,Arabic,France,2007,7.2,Comedy,Drama,Romance,,,,,,PG
Mississippi Mermaid ,François Truffaut,123,"Catherine Deneuve, Jean-Paul Belmondo, Michel Bouquet",antibes|hotel|island|reunion|reunion island,French,France,1969,7.2,Crime,Drama,Romance,,,,,,R
Exotica ,Atom Egoyan,103,"Bruce Greenwood, Mia Kirshner, Sarah Polley",bird|cult film|egg|nightclub|toronto,English,Canada,1994,7.2,Drama,Mystery,Romance,,,,,,R
The Believer ,Henry Bean,98,"Ryan Gosling, Theresa Russell, Summer Phoenix",jew|jewish nazi|nazism|racism|skinhead,English,USA,2001,7.2,Drama,,,,,,,,R
Trees Lounge ,Steve Buscemi,95,"Steve Buscemi, Debi Mazar, Carol Kane",alcoholic drink|bar|drink|drinking|drunk,English,USA,1996,7.2,Comedy,Drama,,,,,,,R
"Sex, Lies, and Videotape ",Steven Soderbergh,100,"Peter Gallagher, Laura San Giacomo, Steven Brill",affair|interview|marriage|sex|videotape,English,USA,1989,7.2,Drama,,,,,,,,R
The Trouble with Harry ,Alfred Hitchcock,99,"Jerry Mathers, John Forsythe, Royal Dano",artist|death|hunting|sheriff|vermont,English,USA,1955,7.2,Comedy,Mystery,Romance,,,,,,Approved
The Knife of Don Juan ,Tom Sanchez,110,"Nataniel Sánchez, Antonio Arrué, Juan Carlos Montoya",,Spanish,USA,2013,7.2,Comedy,Drama,,,,,,,
Sands of Iwo Jima ,Allan Dwan,109,"James Brown, Richard Jaeckel, Forrest Tucker",battle|combat|heroic military|sergeant|tarawa,English,USA,1949,7.2,Action,Drama,Romance,War,,,,,Approved
Shine a Light ,Martin Scorsese,122,"Mick Jagger, Keith Richards, Albert Maysles",band|concert footage|new york city|rolling stones|three word title,English,USA,2008,7.2,Biography,Documentary,Music,,,,,,PG-13
The Sessions ,Ben Lewin,95,"W. Earl Brown, Adam Arkin, Rhea Perlman",falling in love|iron lung|priest|sex surrogate|therapist,English,USA,2012,7.2,Biography,Comedy,Drama,Romance,,,,,R
Frozen River ,Courtney Hunt,97,"Charlie McDermott, Michael O'Keefe, Misty Upham",border|mohawk|money|new york|river,English,USA,2008,7.2,Crime,Drama,,,,,,,R
Bubba Ho-Tep ,Don Coscarelli,92,"Daniel Roebuck, Ossie Davis, Ella Joyce",cult film|elvis|elvis presley|nursing home|texas,English,USA,2002,7.2,Comedy,Fantasy,Mystery,,,,,,R
Slam ,Marc Levin,100,"Sonja Sohn, Saul Williams, Bonz Malone",gang|independent film|prison|racial slur|urban setting,English,USA,1998,7.2,Drama,,,,,,,,R
Brigham City ,Richard Dutcher,119,"Wilford Brimley, Frank Gerrish, Rick Macy",fbi agent|mormon|prayer|sheriff|utah,English,USA,2001,7.2,Crime,Drama,Mystery,,,,,,PG-13
Hidden Away ,Mikel Rueda,96,"Álex Angulo, Germán Alcarazu, Joseba Ugalde",best friend|deportation|moroccan|unrequited love|xenophobia,Spanish,Spain,2014,7.2,Drama,Romance,,,,,,,Unrated
Latter Days ,C. Jay Cox,107,"Joseph Gordon-Levitt, Rob McElhenney, Jacqueline Bisset",christian|male frontal nudity|mormon|mormon missionary|nudity,English,USA,2003,7.2,Comedy,Drama,Romance,,,,,,R
Ruby in Paradise ,Victor Nunez,114,"Allison Dean, Todd Field, Dorothy Lyman",desire|florida|identity|resort town|sales,English,USA,1993,7.2,Drama,Romance,,,,,,,R
Raising Victor Vargas ,Peter Sollett,88,"Victor Rasuk, Melonie Diaz, Judy Marte",based on short film|manhattan new york city|urination|vomiting|watching television,English,France,2002,7.2,Drama,Romance,,,,,,,R
Live-In Maid ,Jorge Gaggero,83,"Norma Aleandro, Hilda Bernard, Claudia Lapacó",buenos aires argentina|economics|housekeeper|maid|servant,Spanish,Argentina,2004,7.2,Drama,,,,,,,,Unrated
The Mudge Boy ,Michael Burke,94,"Zachary Knighton, Tom Guiry, Ryan Donowho",death|farm|fur coat|grief|misfit,English,USA,2003,7.2,Crime,Drama,Romance,,,,,,R
L.I.E. ,Michael Cuesta,97,"Adam LeFevre, Bruce Altman, Walter Masterson",ephebophile|pederasty|pedophilia|playing hooky|shaving,English,USA,2001,7.2,Crime,Drama,,,,,,,NC-17
Half Nelson ,Ryan Fleck,106,"Ryan Gosling, Tristan Mack Wilds, Jeff Lima",bathroom|classroom|dialectics|drugs|student,English,USA,2006,7.2,Drama,,,,,,,,R
Irreplaceable ,Thomas Lilti,102,"François Cluzet, Félix Moati, Marianne Denicourt",doctor|hospital|mayor|no opening credits|title at the end,French,France,2016,7.2,Comedy,Drama,,,,,,,
The Harvest/La Cosecha ,U. Roberto Romano,80,,child labor|education|hispanic|labor|migration,English,USA,2011,7.2,Documentary,,,,,,,,
The Outrageous Sophie Tucker ,William Gazecki,96,"Carol Channing, Bruce Vilanch, Tony Bennett",,English,USA,2014,7.2,Documentary,,,,,,,,
Now Is Good ,Ol Parker,103,"Jeremy Irvine, Olivia Williams, Paddy Considine",death|dying|leukemia|teenage girl|terminal illness,English,UK,2012,7.2,Drama,Romance,,,,,,,PG-13
Tarnation ,Jonathan Caouette,88,"Greg Ayres, Jonathan Caouette, Renee Leblanc",answering machine|home movie|lithium|schizophrenic|video diary,English,USA,2003,7.2,Biography,Documentary,,,,,,,Unrated
Censored Voices ,Mor Loushy,84,Amos Oz,,Hebrew,Israel,2015,7.2,Documentary,History,,,,,,,
Anderson's Cross ,Jerome Elston Scott,98,"Taran Killam, Joanna Cassidy, Ryan Carnes",divorce|marriage|mother daughter relationship|sex|teenage boy,English,USA,2010,7.2,Comedy,Drama,Romance,,,,,,R
Better Luck Tomorrow ,Justin Lin,98,"Parry Shen, Jason Tobin, Collin Kahey",asian american|high school|overachiever|pubic hair|vomiting,English,USA,2002,7.2,Crime,Drama,Romance,,,,,,R
Short Cut to Nirvana: Kumbh Mela ,Maurizio Benazzo,85,"The Dalai Lama, Jasper Johal, Swami Krishnanad",,English,USA,2004,7.2,Documentary,,,,,,,,Unrated
An American Girl Holiday ,Nadia Tass,86,"Mia Farrow, Jordan Bridges, Bruce Gooch",courtship|friend|girl|servant|sister,English,USA,2004,7.2,Drama,Family,,,,,,,
An American in Hollywood ,Sai Varadan,89,"J.D. Williams, Hassan Johnson, Samantha Esteban",place name in title,English,USA,2014,7.2,Drama,,,,,,,,R
Pirates of the Caribbean: At World's End ,Gore Verbinski,169,"Johnny Depp, Orlando Bloom, Jack Davenport",goddess|marriage ceremony|marriage proposal|pirate|singapore,English,USA,2007,7.1,Action,Adventure,Fantasy,,,,,,PG-13
Star Wars: Episode VII - The Force Awakens ,Doug Walker,,"Doug Walker, Rob Walker",,,,,7.1,Documentary,,,,,,,,
Transformers ,Michael Bay,144,"Zack Ward, Michael O'Neill, Kevin Dunn",alien contact|autobot|decepticon|robot vs. robot|teenage hero,English,USA,2007,7.1,Action,Adventure,Sci-Fi,,,,,,PG-13
Thor: The Dark World ,Alan Taylor,112,"Chris Hemsworth, Natalie Portman, Anthony Hopkins",arrest|portal|thor|warrior|weapon,English,USA,2013,7.1,Action,Adventure,Fantasy,,,,,,PG-13
Jason Bourne ,Paul Greengrass,123,"Matt Damon, Riz Ahmed, Ato Essandoh",black ops|chase|cia|cia agent|repeated scene,English,UK,2016,7.1,Action,Thriller,,,,,,,PG-13
The Patriot ,Roland Emmerich,142,"Heath Ledger, Adam Baldwin, Tom Wilkinson",american revolution|british|french|hero|standoff,English,USA,2000,7.1,Action,Drama,History,War,,,,,R
Real Steel ,Shawn Levy,127,"Hugh Jackman, Torey Michael Adkins, Olga Fonda",arena|boxing|boxing movie|robot|robot battle,English,USA,2011,7.1,Action,Drama,Sci-Fi,Sport,,,,,PG-13
"I, Robot ",Alex Proyas,115,"Will Smith, Bruce Greenwood, Chi McBride",humanoid robot|man versus machine|prosthetic limb|robot as pathos|robot vs. robot,English,USA,2004,7.1,Action,Mystery,Sci-Fi,Thriller,,,,,PG-13
The Princess and the Frog ,Ron Clements,97,"Oprah Winfrey, Jenifer Lewis, Anika Noni Rose",amphibian|dream|frog|frog prince|waitress,English,USA,2009,7.1,Animation,Family,Fantasy,Musical,Romance,,,,G
Treasure Planet ,Ron Clements,95,"Joseph Gordon-Levitt, Martin Short, Michael Wincott",alien|cyborg|pirate|planet|treasure,English,USA,2002,7.1,Adventure,Animation,Family,Sci-Fi,,,,,PG
Valkyrie ,Bryan Singer,121,"Tom Cruise, Tom Wilkinson, Thomas Kretschmann",american actor playing foreigner|assassination|conspiracy|military|nazis,English,USA,2008,7.1,Drama,History,Thriller,War,,,,,PG-13
A.I. Artificial Intelligence ,Steven Spielberg,146,"Haley Joel Osment, William Hurt, Kevin Sussman",affection|boy|fairy|future|robot,English,USA,2001,7.1,Adventure,Drama,Sci-Fi,,,,,,PG-13
Hotel Transylvania ,Genndy Tartakovsky,91,"Steve Buscemi, Adam Sandler, Jon Lovitz",dracula|hotel|invisible man|monster|transylvania,English,USA,2012,7.1,Animation,Comedy,Family,Fantasy,,,,,PG
Enchanted ,Kevin Lima,107,"Jeff Bennett, Teala Dunn, Fred Tatasciore",fairy tale|lawyer|love|new york|prince,English,USA,2007,7.1,Animation,Comedy,Family,Fantasy,Musical,Romance,,,PG
Arthur Christmas ,Sarah Smith,97,"Jim Broadbent, Imelda Staunton, Michael Palin",christmas|christmas eve|elf|high tech|resentment,English,UK,2011,7.1,Adventure,Animation,Comedy,Family,Fantasy,,,,PG
Meet Joe Black ,Martin Brest,178,"Anthony Hopkins, Brad Pitt, Jake Weber",birthday|death|death personified|fear of death|wealth,English,USA,1998,7.1,Drama,Fantasy,Romance,,,,,,PG-13
Dredd ,Pete Travis,95,"Wood Harris, Jason Cope, Rakie Ayola",brutality|dark humor|female antagonist|female warrior|post apocalypse,English,UK,2012,7.1,Action,Sci-Fi,,,,,,,R
Mission: Impossible ,Brian De Palma,110,"Tom Cruise, Kristin Scott Thomas, Vanessa Redgrave",disguise|mission|spy|stealing|traitor,English,USA,1996,7.1,Action,Adventure,Thriller,,,,,,PG-13
Charlie Wilson's War ,Mike Nichols,102,"Philip Seymour Hoffman, Tom Hanks, Jud Tylor",afghanistan|arms dealer|based on true story|cia|texas,English,USA,2007,7.1,Biography,Comedy,Drama,History,,,,,R
The Kingdom ,Peter Berg,110,"Jennifer Garner, Frances Fisher, Tim McGraw",al qaeda|bomb making|fbi|saudi arabia|stabbed in the crotch,English,USA,2007,7.1,Action,Drama,Thriller,,,,,,R
Jarhead ,Sam Mendes,125,"Jake Gyllenhaal, Brian Geraghty, James Morrison",american abroad|gulf war|u.s. military|u.s. soldier|usmc,English,Germany,2005,7.1,Action,Drama,War,,,,,,R
Two Brothers ,Jean-Jacques Annaud,109,"David Gant, Jean-Claude Dreyfus, Oanh Nguyen",circus|death of protagonist|jungle|killing an animal|tiger,English,France,2004,7.1,Adventure,Drama,Family,,,,,,PG
Die Hard 2 ,Renny Harlin,124,"Bruce Willis, John Amos, Franco Nero",airport|fuel|plane|police|terrorist,English,USA,1990,7.1,Action,Thriller,,,,,,,R
We Were Soldiers ,Randall Wallace,124,"Jon Hamm, Marc Blucas, Chris Klein",air cavalry|battle|major|soldier|vietnamese,English,USA,2002,7.1,Action,Drama,History,War,,,,,R
